target,title,is_reddit_media_domain,subreddit_subscribers,post_age_min,is_successful_subreddit,is_successful_domain
0,Stephen Fry And His Corgi,1,596515,555.9810649871827,0,1
0,"“Tsimi, Tsimi, Tsimi...” 🇬🇷",1,381433,163.71439832051595,0,1
0,"what a lovely day in the park, I can't wait to go home to my beautiful wife.",1,98578,382.6310649871826,0,1
0,Always have your Kraber ready for Spitfire campers.,1,330497,512.0977316538493,0,1
0,its always a sexual display…,1,120166,619.5977316538493,0,1
0,Shake that belly,1,180424,134.7310649871826,0,1
0,Cat’s Eye Galaxy / M94,1,2236570,668.7810815970103,0,1
0,Post Workout Kasumi,1,353554,685.747748263677,0,1
1,Kinda bummed people are calling the new dungeon “too hard.” I think it’s a nice level of challenge for a normal mode dungeon. Destiny’s “base difficulty” has gone nothing but down for years now. It’s nice to have some “middle tier” content that’s in between normal content and master/GM content.,0,2546176,1077.3644149303436,0,0
0,"He whispers ""believe in yourself."" You have all the talent you need.",1,115868,970.7977482636768,0,1
0,Divide [Nikon N80 / 50mm / Kodak Gold 200],1,1802254,256.29774826367697,0,1
0,[no spoilers] Vi's Cosplay by @merry_brows,1,149876,1016.4310815970103,0,1
1,Alamo Drafthouse offering A Bobs Burgers themed menu to go along with the film,1,284511,846.5310815970103,0,1
1,[Braves] The #Braves today selected the contract of Michael Harris II to the major league roster after optioning OF Travis Demeritte to Triple-A Gwinnett following last night’s game. Harris II will wear No. 23.,0,87639,171.94774826367697,0,0
0,This desert rose (compare to its seedling in 10 inch pot),1,431271,112.99774826367695,0,1
0,Dua Lipa,1,654933,237.84774826367692,0,1
0,Spinning da knife,1,291873,331.7310815970103,0,1
0,At least we can agree now that L comes first,1,41508,247.3144149303436,0,1
1,You had one job,1,1429822,1224.3644149303436,0,1
0,Maddy Deitz,1,207415,454.7144149303437,0,1
0,Warpsmith WIP,1,254753,209.19774826367697,0,1
0,She totally nailed it,1,1459523,606.2977482636769,0,1
0,Dragonflies have started emerging from my pond,0,2826996,356.647748263677,0,0
0,"Whoever made this into a wallpaper, thank you:)",1,76026,268.5144149303436,0,1
0,Raiden by スコッティ,1,71938,425.597748263677,0,1
0,C'mon dude. No excuses,0,254686,658.8644149303436,0,0
0,Truly heartbreaking,1,83338,579.1810815970103,0,1
0,"Landslide destroyed many houses in the state of Pernambuco, Brasil in a matter of seconds due to the heavy rains today.",1,883971,163.21441493034362,0,1
0,when the sun comes up at 2am,1,55316,507.097748263677,0,1
0,[UPDATE]: SHE SAID YES!!!,0,1760327,205.7310815970103,0,0
1,Vit tonåring från Stockholm lore:,1,51429,472.847748263677,0,1
0,mina📸irl,0,32726,449.097748263677,0,0
1,SMOOTH,1,154529,454.5644149303436,0,1
0,"Husband: ""Scientists have found that men say about 10,000 words a day, while women say about 20,000...""",0,23184584,241.04774826367697,0,0
0,Just two unites duking it out.,1,1152851,217.16441493034364,0,1
0,"She was new to soccer. Free to improve her skills, she made many errors, but loved the game. Narta promised herself to never MARRY another mistake like Florian, and to simply enjoy playing the field.",1,189491,186.1810815970103,0,1
1,Schuld an allem!,1,27544,414.5644149303436,0,1
0,I have no one to talk to,1,101991,305.597748263677,0,1
1,Atlanta Apple store workers say ‘intimidation’ has made a fair union vote impossible,0,3420887,684.1144149303436,0,0
0,Leans from the vine,1,32295,368.4644149303437,0,1
1,on being hot and cool,1,180141,563.6644149303436,0,1
1,Vast majority of educators reject Republican proposals for arming teachers,0,8062949,218.78108159701029,1,0
0,Origins of *The Expression*,1,58815,199.91441493034364,0,1
1,Don't forget to lick the knife,1,155797,933.3977482636768,0,1
0,Cute bully <3,1,106184,109.79774826367697,0,1
1,What in the actual joker hell is that Penguin?!? IGN has had this for 10 years and as a kid I was like what is that abomination? What is that thing?,1,153693,633.747748263677,0,1
0,C’est bien que Marvel s’ouvre à la Rance .,1,257479,248.84774826367692,0,1
0,"Meet Enigma, the lost but found criminal",1,787329,214.74774826367693,0,1
1,Only works in red,1,548893,1077.7310815970102,0,1
0,something's wrong,1,89308,283.4810815970103,0,1
0,Budva - Montenegro,1,1215915,576.5144149303436,0,1
1,That's incredible! 👏,1,5088552,583.1477482636769,1,1
1,Haaaaapyyywheeeeelsss,1,1601600,738.3644149303436,0,1
1,NY Yankees will broadcast gun violence facts instead of their game w/ the TB Rays,0,20214052,1156.1644149303436,0,0
0,Arancini - @mrkitskitchen,0,3249390,79.94774826367696,0,0
0,welp...,1,738057,104.44774826367696,0,1
0,‘ere in the bloimy is ‘e,1,96953,839.0810982465744,0,1
0,Pets!,1,383677,284.1144315799077,0,1
1,Kid Pulls Knife Out And Gets Dealt With,1,6228361,131.49776491324107,1,1
1,Pro-gun anti-abortion MAGA yokel harasses anti-gun protesters and then has his sign stolen,1,300228,571.5144315799078,0,1
0,I finally took the L,1,139751,458.84776491324106,0,1
0,my elderly refugee tiger enjoying the English summer,1,293660,336.24776491324104,0,1
1,Huh.,0,872669,1191.6977649132411,0,0
0,The final moments of the SS Andrea Doria (1956),1,977453,156.56443157990773,0,1
0,One hour delay on my cross country drive. Totally worth it.,0,1964772,150.14776491324108,0,0
1,[Film/TV] The Butler that this city deserves. [Static Shock],1,669674,979.5144315799078,0,1
0,Pixel art of my friends OC at the beach,1,634394,217.5144315799077,0,1
0,"DNEG the visual effects company that’s involved in HBO’s TheLastofUs has worked on award-winning projects like: Interstellar, Blade Runner 2049, Dune, Inception, and much more. We can expect some great visuals in TLOU!",0,227358,577.047764913241,0,0
0,Sculptor トト,1,164346,218.34776491324104,0,1
1,Find someone that look at you the way Conner and grant look at Joey 🙂,1,249435,195.4310982465744,0,1
1,That time Marjorie Taylor Greene harassed a child who survived a school shooting because he wanted the government to take action and protect kids like him and his dead friends,1,4021105,349.3310982465744,1,1
0,Lost lake incident,1,108890,812.8397302627563,0,1
0,WCGW running to hug your love,1,6245058,172.88973026275636,1,1
0,"Mt Rainier, Mount Rainier National Park, Washington, United States",1,1008369,1002.1897302627564,0,1
1,Average Indonesian Name,0,27248,192.1730635960897,0,0
1,Why is Reddit roasting us?,1,431548,732.1397302627563,0,1
1,coonmdewn,1,651178,691.9897302627563,0,1
0,When a bug goes right,0,194809,402.956396929423,0,0
0,A little early but here’s my Halloween Clancy piece. High quality version. I hope you all enjoy,1,618674,238.70639692942305,0,1
0,Newest Member of the RPD,1,296855,424.056396929423,0,1
0,'Transgender Has Every Right To Choose Gender': Orissa High Court (India) Orders Family Pension To Transwoman,0,17971382,185.3897302627564,0,0
0,"Test of courage, in a place full of youkais (;´･ω･)",1,112254,200.98973026275635,0,1
0,surely this time ☕,1,131001,306.6897302627564,0,1
1,MLS: Stuck in the 90's-What if Modern MLS Teams Existed in 1996? (Part 1),1,391048,235.756396929423,0,1
0,it's true,1,31125,512.5897302627563,0,1
0,40 years young. What do you think of my 1982 Chevy C10,1,960749,171.55639692942302,0,1
1,Cursed_we,1,167086,1011.8397302627563,0,1
0,When somebody asks me what month it currently is,1,1119171,954.3730635960897,0,1
0,Teefies? More like Ouchies!,1,316167,1051.756396929423,0,1
1,YSK that the majority of Ivy League schools in the US offer free tuition to students whose families earn $65k per year or less,0,3581505,801.5897302627563,0,0
0,I am doing my part preaching the good word.,0,443967,933.1730802337328,0,0
0,We need to do something.,1,276456,216.0064135670662,0,1
0,This boy do be strong tho,1,227855,626.7564135670661,0,1
0,Big cat is having the time of his life,0,139047,514.5230802337329,0,0
1,Beware Tails fans,1,148047,796.2230802337328,0,1
1,"🔥 Bald Eagle swoops in, steals food right out of the mouth of a Gray Wolf.",1,6854267,1069.2730802337328,0,1
1,[Self] Me cosplaying my Redguard Sword-Singer character from Skyrim.,1,32965076,140.47308023373287,1,1
1,A fresh update!,0,3048839,840.7230802337328,0,0
0,"Not the prettiest landscape, but quite the sunrise. Thanks Tennessee.",1,251811,275.3897469003996,0,1
0,there is impostor,1,23398,252.7564135670662,0,1
1,My Valtan experience compared week 1 and 2,0,328597,496.7564135670662,0,0
0,poor 650 kg Ariel Atom gets bullied : (,1,292208,597.1897469003995,0,1
1,"Relapsed at day 69! and ruined my longest streak, already feel like shit",1,963664,179.3064135670662,0,1
0,Girl will be girl,1,988910,701.2564135670661,0,1
0,Moo brushies,1,874418,269.5564135670662,0,1
0,to prove that you are not drunk,1,2900583,426.93974690039954,0,1
0,Beautiful,1,338590,448.02308023373286,0,1
1,eli5: Why do worms get out on the asphalt when it's raining?,0,20643382,775.8397469003995,0,0
0,"Are you ready to start making it in defi? Then look no further than The Web3 Project(TW3P) where you will find a dual rebase on supply and liquidity, along with Miners, Governance, NFTs and Staking. Come find out how to join the Oshies VIP Club. Experience the highest APY + APY",0,1757370,241.78974690039956,0,0
0,True chad give people advice for life,1,51659,275.4064135670662,0,1
0,uma pequena trolagem keikeikeikeikeikeikeikeikei,1,130863,325.68974690039954,0,1
0,"Ah yes, Resident Evil II",1,601142,245.33974690039952,0,1
0,Its a Finnegan fox!,1,172071,581.7064135670662,0,1
1,Anti-Flag Die for the Government (punk),0,29735335,899.5564135670662,0,0
0,Thanks for nothing Tarkin,1,379795,113.87308023373286,0,1
0,"A swimming Feather Star (Crinoid). The earliest known crinoid groups date back to the Ordovician, 480 million years ago.",1,114873,185.4230802337329,0,1
1,Woman gives birth standing up in the hospital lobby [NSFW],1,869898,888.3564135670662,0,1
1,"""Io questa la vedo come una vittoria""",1,252281,668.6897469003995,0,1
1,Does anyone know more about this.,1,561286,224.2064135670662,0,1
0,Jungle void,1,392626,903.9564135670662,0,1
1,I would highly recommend the 2002 Ford Ranger,1,1148504,1013.5230802337328,0,1
0,First post,1,1999936,524.2564135670661,1,1
0,EVERYBODY needs to watch this! A professor is saying and explaining everything we are saying. He‘s exposing wallstreet and Jim clown Cramer. Upvote the linked post so that more people see it! I already shared it with everyone I know.,0,787892,424.5064135670662,1,0
0,josuke help,1,1016657,642.9897469003995,0,1
1,"After 2 years of self learning, I (30yo) got a job as a junior web developer.",0,3082600,439.5064135670662,0,0
1,R.I.P for Tom,1,761306,596.6564135670662,0,1
0,Instant karma,1,253755,316.82308023373287,0,1
1,Anon steals coffee,1,1348714,788.4064135670662,1,1
0,She sure is thrilled,1,2108948,220.63974690039956,0,1
1,Procrastination 101,0,383407,213.77308023373288,0,0
0,"“No man ever steps in the same river twice, for it's not the same river and he's not the same man.” -Heraclitus [1080x1350]",1,839553,352.27308023373286,0,1
0,Lost in the 90th minute and the players decided to 69,1,172330,725.7564135670661,0,1
0,"My entry for the Pokémon TCG art contest. Wasn’t selected this time, but it was fun to work on. Excited to see the final selections when they print them.",1,169832,101.42308023373286,0,1
1,No one even knows I have Reddit,1,392918,1001.256413567066,0,1
0,I made what was probably my best pizza ever,0,387425,143.2064135670662,0,0
0,"Palace of Sans Souci - Milot, Haiti - 1813",1,148179,208.1730802337329,0,1
0,Stop the burning flyer posts please,0,171317,108.88974690039952,0,0
0,Cool story Viprin,1,95796,471.13974690039953,0,1
0,"Paperface, by me, 2022",1,153234,373.32308023373287,0,1
0,Top 1 Mathmech against 3 Splights in an OCG tournament.,1,282668,303.0564135670662,0,1
1,PsBattle: Rock of Decebalus,1,17972116,996.6730802337328,0,1
0,Too soon?,1,684265,60.07308023373286,0,1
1,Post from FB “Lost my Dota best friend today to cancer” - Naqib Martinie,0,1074569,655.5397469003996,0,0
1,A Facebook friend held a fundraiser and Andrew Luck showed up to support lol,0,84794,162.63974690039953,0,0
1,Since it’s gonna be pride month soon I thought this was appropriate,1,118540,647.7564135670661,0,1
1,agoi,1,861422,735.6230802337328,0,1
0,I made a drawing. How's it ?,1,139777,545.9730802337328,0,1
0,Xavier is at it again,1,1830521,161.4397469003995,0,1
0,Shark statue found at the bottom of lake Neuchatel in Switzerland,1,469629,197.38974690039956,0,1
0,A laugh every time!,1,214171,359.43974690039954,0,1
1,New Card Revealed - Clash of the Colossals,1,1867517,87.43974690039953,0,1
1,Feeling especially pretty,1,225633,343.4064135670662,0,1
0,Zum Glück lese ich jedes Straßenschild,0,627346,497.18974690039954,0,0
1,cznburak making a Pizza,1,9719021,416.0897469003995,1,1
0,"""Le-Le-Legoshi!"" [FreneticWolf]",0,89888,258.2564135670662,0,0
0,they never see this one comin,1,303538,567.8564135670662,0,1
1,Genuinely thought they were getting married for a second before I saw the whole image. Just bros things.,0,344179,924.3730802337328,0,0
0,Update from Tripper,0,43231,138.8564135670662,0,0
0,"Hall Pass premiere, 2011",0,218429,353.6397469003996,0,0
0,In some countries you should be extra careful where you swim.,1,158390,371.7064135670662,0,1
1,Annoyed Komi is underrated,1,167486,1023.0564135670662,0,1
0,we were just working out!,1,23818,268.9564135670662,0,1
0,Cow infects another cow with its happiness,0,375646,505.88974690039953,0,0
0,Eunie by @SMKittyKat,1,106635,197.0564135670662,0,1
1,U.S. Treasury pushes Russia towards default: What next?,0,2208080,179.88974690039953,0,0
1,are you sure you have moved on...? (ruined Aether portal v2 by me),1,6569854,704.7897469003996,0,1
1,I think I found my dream guy,1,5360478,1228.2230802337328,0,1
0,Confetti Snippets - Add a copy button to all code blocks in Stackoverflow,0,16130466,359.70643013715744,0,0
1,"This is the ""public safety"" discussion we *should* be having",1,769589,1015.0230968038242,0,1
0,Dog sitter sent me this piece of art with no context.,0,1905350,205.66319626967112,0,0
0,"If R* won't make the content in RDO, me and the boys will 😎",1,355789,225.6798629363378,0,1
0,"My first attempt at DIY landscaping, making my wife a proper garden.",0,558572,284.67986293633777,0,0
0,UK hits oil and gas companies with $6 billion windfall tax,0,350682,456.9131962696711,0,0
0,Lego Longsword: +25 atk. 100% chance of a critical hit and inflicting Bleed if struck on an enemy’s foot.,1,486442,644.9465296030045,0,1
1,"‘Top Gun: Maverick’ Still Taking Breath Away With $150M Memorial Day Opening, Best Ever For Tom Cruise – Saturday AM Update",0,864032,116.66319626967112,0,0
0,A trinity of electropriestesses by Nictanova,1,122300,382.46319626967113,0,1
0,"Let's send the NRA fuckwads to ""school""...",1,150083,109.84652960300446,0,1
1,One thing I hope the new Daredevil show does is keep the traditional “one take” fight scene. Too iconic to leave out,1,2602345,868.0298629363377,0,1
1,[Fabrizio Romano] Ivan Perisic accepts offer to join Spurs when Inter deal ends next month,0,113058,401.0631962696711,0,0
0,thought this was neat and wanted to share,1,92346,220.81319626967112,0,1
1,"For the loners, what activity have you found to be rather nice alone?",0,3794184,248.9298629363378,0,0
1,Oh no…,1,398611,220.64652960300447,0,1
0,"For memorial day, my dad's commissioning, 1968",0,99852,261.0798629363378,0,0
0,Ganyu & the Liyue girls being bosses (by: change三生烟),1,41850,690.8631962696711,0,1
0,"So, everytime a communist regime fails it wasn't ""real communism? Okay, got it.",1,61598,336.8631962696711,0,1
0,YOU KNOW HOW MUCH I SACRIFICED?,1,60608,260.76319626967114,0,1
1,Who the fuck is this guy!?!?,1,1079315,664.6631962696712,0,1
1,"William Regal: Bryan Danielson Is Like My Fourth Son, He’s The Perfect Wrestler",0,632308,196.0298629363378,1,0
1,Battlefield 3 & 4 Rank Systems,1,411999,604.2298629363378,0,1
0,Toiled over sewing a dog bed for dog. Dog refuses to get on it,1,4818882,294.5298629363378,0,1
1,Its been 1 week since xQc uploaded. Currently suffering from depression because of this. Stopped with school and talking friends. Locked myself and stopped eating. You better upload FeelsWeirdMan,1,259165,422.7298629363378,0,1
0,My friend got to meet a legend as he was moving to Japan,1,3601597,209.0131962696711,0,1
1,When someone enters the bathroom after you and you hear their cries at the bomb you dropped in there.,1,1138131,1017.2465296030044,1,1
0,My little Old lady wishes you a nice weekend,1,274304,381.6298629363378,0,1
1,True friends laugh instead of helping,1,3837150,1017.2465296030044,0,1
0,Obviously,1,238336,403.39652960300447,1,1
1,"Ten Hag has called several times to convince FDJ. At first, De Jong was unwilling to listen to offers, because he wants to play in CL, but during the calls, ETH explained the project to De Jong, and little by little the Dutchman took a closer look at the operation. [Oriol Domenech]",0,368738,609.1798629363378,0,0
0,Ronon's gun concept art by James Robbins,1,111501,135.14652960300447,0,1
1,This is the only rule for r/soda,1,835283,1115.5631962696712,0,1
1,"Ok, which one of you left this review of Kyle's new store?",1,182445,816.5965296030045,0,1
0,Deciding at the last minute you want to take your Jedi dark side,1,202008,351.74652960300443,0,1
1,Star Wars Jedi: Survivor - Official Teaser,0,2311500,1165.729862936338,0,0
0,Dreamer by Robbie Trevino,0,197958,206.57986293633775,0,0
0,What specific type of flower is on the 'Traditional Chinese branch' logo?,1,638911,236.59652960300448,0,1
0,"Bonded babies, Bear and Lula",0,69579,630.0298629363377,0,0
0,dog,0,46643,338.0631962696711,0,0
0,binty pls stop playing the,1,60359,293.29652960300444,0,1
0,hotel base casino and cheese,1,100493,443.4131962696711,0,1
0,Subaru x Luna,1,35479,528.6465296030044,0,1
0,I made the pizza add boss.,1,25524,288.9465296030045,0,1
0,F ...,1,608452,510.6631962696711,0,1
1,Jellied Fish,1,1832110,1037.7965296030045,0,1
1,Sniper horizon 5,1,3758621,659.3298629363378,0,1
1,"Ask your dates if they support the right to choose, ask who they voted for, ask if they believe in equal rights for all. Boycott shitty people",0,536487,1030.1798629363377,0,0
0,Because nobody has ever worked at a different store location before,1,294048,784.5965296030045,0,1
0,Banana has reached her 30k goal for her 24hr St Jude charity stream!,0,148045,254.56319626967112,0,0
0,Doing makeup for a dark club environment looks way OTT in the day.,1,217731,259.5298629363378,0,1
0,No Foul No Fault,1,104980,186.94652960300445,0,1
0,2B & Pod 042 by @hapidevy,1,164120,554.4965296030044,0,1
0,Sigma Oogway,1,40440,485.4465296030045,0,1
0,This Crash. Crash needy when dad get home work.,1,283714,733.2631962696711,0,1
0,We can call it home now! 1.5 acres of pure bliss,1,111329,154.8798795580864,0,1
0,Savages,1,86093,674.746546224753,0,1
0,The Death Knight and the Flame Emperor,1,77848,197.3298795580864,0,1
0,"U.S Marines From 3rd battalion,4th Marine Regiment in a firefight with the Iraqi forces in the streets of Baghdad April 6,2003 [1080x1348]",1,525562,273.44654622475304,0,1
0,"In max payne 3, you can actually hear bullet casings falling down the escalator",1,228894,819.2632128914197,0,1
0,Modiji uses reddit(confirmed),1,303804,616.0132128914197,0,1
1,Documenting more of my sourdough journey!!!!,1,619124,734.2798795580863,0,1
0,What a difference 4 weeks made!,1,76723,465.04654622475306,0,1
0,anybody else getting ready for service? let's see some battle stations!,1,291859,179.21321289141972,0,1
0,"Tall kitchen with white-washed cypress walls and wood slat ceiling in an open plan living space, Round Top, Fayette County, Texas. By Marie Flanigan Interiors.",0,543216,111.61321289141974,0,0
0,"Side comparison of J10C, EF-2000 and F-16C [966 × 1199]",1,155738,182.4798795580864,0,1
0,What the fuck,1,35378,195.84654622475307,0,1
0,This tile on my dad’s bathroom floor looked familiar (Kurt Vonnegut),0,578626,769.896546224753,0,0
0,Financial advice,1,831345,446.6632128914197,0,1
0,Two Smug Blondes.,1,94921,375.9132128914197,0,1
0,least loyal star guard,1,47673,302.21321289141974,0,1
0,Perfect way to start the weekend!,0,21463161,266.49654622475305,0,0
1,egg👁👁irl,1,255572,927.746546224753,0,1
0,"Dialing in a 40,000lb shaft",1,144069,260.0298795580864,0,1
1,The worst person you know just had a good take,0,536718,1262.3132128914197,0,0
0,"Thank you, thank you",1,465466,222.9798795580864,0,1
0,Day 715 of poorly drawing hollow knight until silksong comes out,1,329601,793.6798795580864,0,1
1,autism and adhd awareness,0,351860,1170.7632128914197,0,0
1,Bangers,1,2218488,863.8798795580864,0,1
0,Did you know Minecraft has 866 different vanilla structures you can place with structure blocks?,1,791024,191.6798795580864,0,1
0,"A Yugoslav Army soldier killed by Slovene police in a military van in Kozina, Slovenia. June, 1991 (682x454)",1,3171767,515.1632128914197,0,1
0,"Why would you even agree to trial if my club ""doesn't have financial muscle for your contract demands""?!!!",1,247617,405.446546224753,0,1
0,Finally the silent king is ready. First the menirs with shield and snow,0,44320,202.3132128914197,0,0
1,After all this time i finally reached MR30 and gave my first blessing!,0,562209,435.04654622475306,0,0
0,"Uh-Oh, I Guess There Might Not be a Rimworld 2",1,360153,978.6632128914196,0,1
0,Champ Shit Only,1,96957,235.7298795580864,0,1
0,I played OG True Love at a party and got kicked out,0,107380,761.6965462247531,0,0
0,"In 1943, six Jewish boys escaped from a railcar bound for a death camp. They later came across Erna Petri, the wife of an SS officer. She took them home and fed them, then waited for her husband. When he didn't arrive, Erna personally took the boys out into the woods and shot them execution-style.",0,342539,160.99654622475308,0,0
0,Little sketch I made. I can’t draw that well but had fun with this one.,1,21149,270.5298795580864,0,1
1,Hi! I am a former Chuck e cheese castmember ask me anything!,0,22046893,1043.3132128914197,0,0
0,Así que había que hacer todo eso para tener sexo,1,406943,233.34654622475307,0,1
0,"American heavy machine gun crew credited with killing half of the 109 Japanese soldiers who were slain on Biak Island on the 22nd of June, 1944.",1,170288,279.6298795580864,0,1
0,We need to mod this,0,61069,404.6798795580864,0,0
1,Did You Know? In Morbius (2022)?,0,823003,279.6132128914197,0,0
0,"In which the 64,000 dollar question is whether a preschool can be sued for (intentionally?) underpaying someone for nearly a decade.",0,817831,219.0798795580864,0,0
1,I work for Easons and they are increasing item prices just to put them on ‘sale’ immediately. Who do I report this to?,0,523368,318.7298795580864,0,0
1,ACAB,1,719477,1061.746546224753,0,1
1,let's see your new superpower,1,19061159,333.34654622475307,1,1
0,Didn't catculate that correctly,1,306477,476.3132128914197,0,1
0,Rescue grabbies,1,173381,419.0767873843511,0,1
0,Though you guys would appreciate these gorgeous portuguese book covers,1,1124980,275.7434540510177,0,1
0,Man on a mission in downtown Helsinki,1,121789,222.8767873843511,0,1
1,Viking vibes. Would you run away too?,1,376665,807.3767873843511,0,1
1,This made me laugh so damn hard,1,759173,892.1101207176845,0,1
0,Girl goes to school in Celtic warrior queen costume after pupils asked to dress as royal family members.,0,28160,349.4934540510177,0,0
0,Dan Povenmire (voice actor of Doofenshmirtz) made a Tiktok using Spiegel's statements 😂,1,51043,253.01012071768443,0,1
0,Miro Heiskanen makes it 1-1 with a backhand,1,1429292,264.29345405101776,0,1
0,Holesome reddit,1,53570,562.3434540510177,0,1
0,Gandalf and Bilbo (original art by the Slovak artist Peter Klúcik),1,35064,301.5767873843511,0,1
0,[repost]/[found] - currently posting from a train,1,887692,294.4934540510177,0,1
0,Come by and say hi!,1,116291,272.16012071768444,0,1
0,Sam helping himself @ Farm Animal Refuge,1,67383,203.3267873843511,0,1
0,The Bond girl that we needed,1,133698,706.5101207176845,0,1
0,Itto the blue oni,1,28257,383.5767873843511,0,1
1,"Mom, I lost it with Dad about his guns post on Facebook.",0,257674,759.1267873843511,0,0
0,At least we can agree that L comes first,1,236562,224.4601207176844,0,1
0,Seems legit.,1,40814502,225.09345405101777,1,1
0,It jumped,1,278649,197.51012071768443,0,1
1,"Romano Twitter - Eddie Nketiah’s new contract will be valid until June 2027. Five year deal now set to be signed, as Arsenal wanted him to stay at all costs. ⚪️🔴",0,235163,459.74345405101775,0,0
0,Foolishness Sonic...,1,124741,218.3601207176844,0,1
1,Motorcyclist chases POS driver who fled after Hit and Run,1,1881230,423.0601207176844,0,1
0,forgot about this pizza my group ordered in 2019. Michigan coney dog pizza.,1,131375,200.6767873843511,0,1
0,One of my comfort episodes,1,382067,305.44345405101774,0,1
0,Protein 🤤🤤🤤,1,35608,382.94345405101774,0,1
0,do you get deja vu? huh,1,580484,276.8434540510178,1,1
0,Working as intended,1,63532,194.7267873843511,0,1
0,Older brother Jouta to the rescue !! (art by me),1,227719,62.66012071768443,0,1
1,Poor Stargate,1,71932,511.7101207176845,0,1
0,Fleta really is meta,1,281173,234.6767873843511,0,1
0,DIY powerwasher,1,416178,722.8434540510177,0,1
0,FNF leakers be like,1,115049,387.5934540510178,0,1
0,IT'S MORBIN TIME,1,220705,153.2267873843511,0,1
0,"Wait, it’s all memes?",1,134604,220.26012071768443,0,1
1,Fifteen-year-old boy seriously injured in vile South Melbourne tram attack,0,494624,469.8267873843511,0,0
0,P*tler 🤮🤮🤮🤮 and Winnie the Pooh,1,46800,388.3601207176844,0,1
0,How to seduce the ladies,1,4210561,577.5267873843511,0,1
0,It's real!,1,27192,164.4767873843511,0,1
0,"True, true, true…",1,93300,269.3434540510178,0,1
0,I dont know why,1,40565,413.54345405101776,0,1
0,Fresh set today ✨,1,531308,516.3601207176845,0,1
