target,title,is_reddit_media_domain,subreddit_subscribers,post_age_min,is_successful_subreddit,is_successful_domain
1,I got new teeth today after having bad teeth my whole life!,0,5491453,259.1151085178057,1,0
1,My avocado today was 11/10.,1,6922967,294.66512516736987,1,1
1,Husband of teacher killed in Texas school shooting dies from heart attack,0,24714016,334.4317918340365,1,0
1,Twitter shareholder sues Elon Musk for tanking the company’s stock,0,12072559,314.7984585007032,1,0
1,Valtteri giving his last print to Lewis,1,2129504,321.7484585007032,1,1
1,Found at a local brewery! Finally have something to water my plants with.,1,40779074,186.2817918340365,1,1
1,That'll send a message.,1,2535743,359.9317918340365,1,1
1,These colors don't run*,0,1512050,381.1817918340365,1,0
1,These folks were quacking for food but specifically spit out and shook their heads at my strawberries and bananas. Pft. So rude.,1,2314970,211.8817918340365,0,1
1,+11.54% (5/26/22),1,787345,223.76512516736983,1,1
1,[OC] Pokémon Emerald! Me on my first day with the bike :P,1,4038912,363.2651251673698,0,1
1,"I drove 5,000 miles last summer and this was one of the most incredible spots I visited | Monument Valley, AZ [3527x4564][OC]",1,22082194,361.11512516736985,0,1
1,Andor - Official Trailer,0,2225992,309.8817918340365,1,0
1,My 77 year old Catholic aunt told us she made a meme and sent this in my family group chat. It pissed off half the family. 😂 She is such a treasure.,1,533820,344.81512516736984,0,1
1,"Don’t really have any friends to tell, but I finally managed to pass my driving test at 30 years old after 3 attempts!",0,1075642,369.3817918340365,1,0
1,RIP Ray Liotta (Voice of Tommy Vercetti),1,32947830,431.7817918340365,1,1
1,Not so silent but deadly,1,19034506,355.6817918340365,1,1
1,Plague Inc. is 10 years old today! I’m the creator of Plague Inc. and Rebel Inc. Ask me anything!,0,22042709,402.7151251673698,0,0
1,I invited all my matches to a Memorial Day bbq at my house,0,5358080,399.3817918340365,0,0
1,‘Goodfellas’ Star Ray Liotta Dies at 67,0,27981375,458.1484585007032,0,0
1,Cool and Smooth bike trick,1,6219150,368.5984585007032,1,1
1,It’s a treason then,1,2082968,278.3984585007032,1,1
1,"This sign at El Arroyo in Austin, Texas recently",1,29002840,349.3984585007032,1,1
1,"I've had a birthmark under my breast that I have been super self concious about my whole life, and finally got it turned into a work of art! Credit goes to Hannah at Birds of Paradox in Kenosha, WI. I couldn't be happier with the outcome!",0,4848577,463.2651251673698,0,0
1,🔮WallStreetBets Predictions Tournament for May 2022🔮,0,12178825,990.91512516737,0,0
1,Today’s (5/26/2022) edition of the Uvalde Leader-News,1,9711513,450.0818096677462,1,1
1,Trader Joe,1,6275383,475.2484763344129,1,1
1,The 'down' button for this elevator is just an upside down 'up' button.,1,19956176,393.0651430010796,1,1
1,Shocked to the core.,1,11459889,261.4984763344129,0,1
1,the real victims or arms businesses,1,769129,426.5651430010796,0,1
1,Just sign this document that will dock you 11.5 hours….,0,2115501,385.4984763344129,0,0
1,"The last three years (2015, 2017, 2018) Kendrick Lamar dropped an album, the Golden State Warriors won a championship. Kendrick dropped an album this year.",0,4796982,408.7984763344129,1,0
1,Fourth-grader who survived Uvalde school shooting gives heartbreaking account of what gunman told students and what followed after,1,4017643,349.7984763344129,1,1
1,TIFU by sleeping with a ‘normal’ tinder guy,0,17960455,350.3318096677462,0,0
1,Mr.Bean has taught us that sitting alone and enjoying your own company is better than being surrounded by fake people.,0,24753870,280.5818096677462,0,0
1,WWDC 2022 Predictions,0,3417338,1052.731809667746,0,0
1,R.I.P. Ray Liotta. Joe Pesci and Ray Liotta’s infamous “Funny how?” Goodfellas scene was improvised. Director Martin Scorsese and the two actors kept it a secret to record the real reaction of extras.,1,5075264,343.4651430010796,1,1
1,Head custodian is shocked as he is gifted a new car so he doesn't have to walk to his job anymore🥺,1,3615799,268.6318096677462,0,1
1,Police face questions over response to Uvalde school shooting,0,24714016,379.1318096677462,1,0
1,A polite deer bowing in Japan for a Cookie,0,3419790,383.2151430010796,0,0
1,she was ***NOT*** the bride,1,1332375,498.78180966774624,0,1
1,Joe Biden said mass shootings tripled when the assault weapon ban ended. They did,0,8061245,523.8651596665383,1,0
1,🔥 Volcano too weak to erupt 🌋,1,6837882,471.6484929998716,0,1
1,found this on Twitter and had to share😭,1,740772,517.2984929998715,0,1
1,Sheogorath at my school lol,1,1313826,303.6484929998716,0,1
1,Based on a true story,1,993386,363.9484929998716,1,1
1,Slow-motion juggling,0,21462306,225.3984929998716,0,0
1,The man climbed out of his eighth floor apartment window to catch the helpless three-year-old girl.,1,3635834,557.2318263332049,1,1
1,Blursed_fighter planes,1,2389311,257.2818263332049,0,1
1,Hidden in an enchanted forest,1,1806248,332.7318263332049,0,1
1,Where is my switch case gang at?,0,1995375,467.8318263332049,1,0
1,Yup. This is between you two.,1,1955444,464.3484929998716,1,1
1,"Somewhere in Australia... because fuck you, that's why.",1,2323177,394.4984929998716,0,1
1,360 basketball POV. looks amazing,1,6224279,293.7984929998716,1,1
1,I miss grammar Nazis.,0,2542918,372.5984929998716,0,0
1,The police really do be like that...,1,5625196,479.7318263332049,1,1
1,ponytail guy says aikido is best so he challenges bald mma guy,1,1507605,333.5318263332049,0,1
1,absolutely beautiful,1,31221414,564.1818263332049,1,1
1,When attending a tech conference make sure your nails match,0,6120425,508.1484929998716,0,0
1,Men abducted en masse in Chechnya and sent to fight against Ukraine – media,0,28901783,378.76515966653824,1,0
1,Assuming this hasn't been posted here before,1,236562,179.23184303045272,1,1
1,Child proof tampering,0,2535743,282.6985096971194,1,0
1,"""What I watched here was a disgrace""",1,2710495,576.9818430304528,0,1
1,Anon makes cashier mad,1,1348000,402.5818430304527,1,1
1,But He Was Always So Nice,1,3287453,301.4485096971194,0,1
1,me_irlgbt,1,240328,407.31517636378607,0,1
1,meirl,1,1740002,514.4818430304528,0,1
1,When Hogwarts shuts down for Covid,1,1247186,449.7818430304527,0,1
1,"Doesn’t see the pattern, does he?",1,432433,522.7318430304528,0,1
1,[Homemade] Nashville hot chicken sandwich on homemade bun,1,22516623,597.6151763637861,0,1
1,Someone's marketing team should have thought this through,1,2921965,523.565176363786,0,1
0,First time hearing this line and I lost it 😂,0,684238,451.0818430304527,0,0
1,Good boy makes a new butterfly friend,1,5294635,412.8651763637861,0,1
0,Cursed_Walter White,1,3211055,365.76517636378605,0,1
1,"Outside valves office building, got kicked out. :( #savetf2",1,738373,337.21517636378604,0,1
1,TIL that a third of the items returned to Amazon are simply destroyed in order to save time and space.,0,27691578,650.2985096971194,1,0
1,To make a goal,1,2892602,370.7985096971194,0,1
1,PSA - Why the cops won’t help you when you’re being stabbed,0,26439612,587.515176363786,0,0
1,"US government: ""People are living in poverty. Let's spend more money on weapons.""",1,284698,323.5318430304527,0,1
1,Missed by inches,1,3747271,576.1818430304527,1,1
1,What a sweet little Spanish fella bless him,1,1075642,315.23184303045275,1,1
1,Received my piece of a shot down SU-34 in mail today from dronesforukraine.fund,1,727724,284.1985263625781,1,1
1,Be like Aragorn.,1,1136177,618.9985263625781,1,1
0,Little dumbass,1,2925871,224.24852636257808,0,1
1,"Children in front of world’s largest log cabin in Portland, Oregon, USA 1938. Built In 1905 burned down In 1964 [700 x 1014]",1,3170356,648.5818596959114,0,1
1,12500% Borrow fee??? 🤣🤣🤣,1,787345,151.6318596959114,1,1
1,The pair were married for 24 years and had four children together,1,1429358,295.34852636257807,0,1
1,Whenever we turn a fan or air filter on our little girl goes and sits right in front of it and makes her ‘fan face’,1,550311,384.2818596959114,0,1
1,Turns out we can't use spell parry against that,1,1371884,265.63185969591143,1,1
0,That's not how it works Karen,1,1033352,59.29852636257807,0,1
1,All new blocks and items in 1.19: The Wild Update :),1,6564998,472.5651930292448,0,1
1,Imagine going out for a walk and bumping into Klopp and Stevie having a pint! This kid is living the dream!,1,380671,236.0318596959114,0,1
1,The Neighbors' children who live above us won't stop throwing trash at our garden,1,4267834,668.0151930292448,1,1
0,Attack! Wait. Nevermind…,1,4027367,532.2985263625781,0,1
0,What language even is that?,1,651098,338.21519302924474,0,1
1,Plot twist,1,897099,520.2651930292448,0,1
1,I love him in every universe,1,392712,563.6151930292448,0,1
1,Wetness is the essence of beauty,1,4988828,661.7818596959114,0,1
1,Who else collects their cats' whiskers?,0,3524071,365.3651930292447,1,0
1,"During the 1936 Olympics, two Japanese Pole Vaulters tied for second. After declining to compete against another, Shu-hei Nashida won silver and Sueo Oe won bronze. Upon returning to Japan, they cut the medals in half and joined them together to make 'friendship medals.'",1,5075264,509.6318596959114,1,1
1,So suave and smooth with a masterful ending!,1,5491454,481.8773448705673,1,1
1,Llama Kuzco is finished! I’m so thrilled with how this turned out!,0,617044,386.9773448705673,0,0
0,"Thanks, I hate ladybugs",0,1560158,256.7273448705673,0,0
1,A little game of shooting fireworks from your face,1,2208809,180.96067820390064,0,1
1,"I, for one, have quite a few",1,361871,450.6773448705673,0,1
1,The sexual tension in this friend group is too high,1,1233561,584.544011537234,0,1
1,We Work Just As Hard As Them,1,546774,447.32734487056734,0,1
1,N.W.A. - Fuk Da Police,0,29723131,326.644011537234,0,0
1,me_irl,1,5805136,677.894011537234,0,1
0,"Huh, I never thought about this",1,3089926,343.294011537234,0,1
1,Senator who has received $1m from NRA runs into a locked door trying to avoid Texas shooting questions,0,8061245,548.6773448705674,1,0
1,How to make a meme!,1,1964445,662.3106782039007,0,1
1,Ted Cruz - permanent member nomination,1,438431,612.794011537234,0,1
1,Literally 1984,1,186310,313.96067820390067,0,1
1,Jolyne why would you spoil that,1,1016312,380.3606782039007,0,1
1,It's easy as that,1,2066589,713.844011537234,0,1
1,All Cops Are Bastards.,1,116025,507.1773448705673,0,1
1,trans rights,1,536301,290.7273448705673,0,1
1,IMPORTANT PSA PLEASE SHARE,0,1165716,549.694011537234,1,0
0,found on facebook,1,751818,459.444011537234,0,1
1,"this is how they check if the structure is tilted during Al-Andalus golden age, if it won’t spin it means the structure needs repairing",1,9711513,420.2606782039007,1,1
1,Katrina told me this fortune right after I finished my garden in memory of my grandma. :’),0,1759950,407.9773626923561,0,0
1,"In Shin Godzilla(2016), when we are shown the social media reactions to the disaster, the username and profile pic of one user is a reference to the characters from director Hideki Anno's most famous work: Neon Genesis Evangelion.",0,3160364,485.6440293590228,0,0
1,First Image of Harrison Ford in 'Indiana Jones 5',1,27981375,266.2440293590228,0,1
1,The accuracy.,1,160325,469.2273626923561,0,1
1,Zelenskyy slams Henry Kissinger for emerging 'from the deep past' to suggest Ukraine cede territory to Russia,0,28901787,589.9440293590228,1,0
1,One eyed leopard killing a warthog,1,2329749,588.2273626923561,0,1
0,Thanks mom,1,1623182,467.5773626923561,0,1
1,Finally Finished! Muppets Christmas Carol MOC,1,869335,589.8773626923561,0,1
1,After three long years I´m happy to announce that I will be exhibiting my works to the public again!,1,29002840,593.7606960256894,1,1
1,Chinese were compulsory sent to the FangCang camps(where detain the people were suspicious of Positive of Covid virus.,1,1466004,410.4106960256895,0,1
1,Marcella Giulia Pace's many colors of the Moon took 10 years to complete.,1,2414322,436.2106960256895,0,1
1,these caravans are getting out of hand.,1,398531,541.7106960256895,0,1
1,"Just a reminder, in 1919 Winnipeg had a mass general strike in which tens of thousands took to the streets and flipped over trolley carts in the name of workers rights and living wages.",0,233987,346.6440293590228,0,0
1,Anon on nukes,1,1348000,562.1106960256894,1,1
1,Cat person,1,1830793,728.6107115864754,0,1
1,News is sad these days,1,4208556,748.277378253142,0,1
1,The CEO of IKEA has just been appointed as the Prime Minister of Sweden.,0,23166822,530.4773782531421,0,0
1,They’d be less cowardly at least,0,5551773,759.6940449198087,0,0
1,Falcon in Hunting Mode Unfazed by Strong Winds,1,6219153,597.3773782531421,1,1
0,Still Applies. Shove It With Your Thoughts & Prayers™,1,263740,422.927378253142,0,1
1,My coworker waited weeks for a used transmission for a hybrid Tahoe. It finally showed up and he tipped it up and water ran out of it for a solid 60 seconds.,1,1684971,631.1440449198087,0,1
0,what did Brad do?,1,1141504,303.27737825314205,0,1
1,Current state of MCU phase 4,1,2214767,472.2607115864754,0,1
1,"Record Player, 3D Zoetrope",1,3123293,707.5607115864753,0,1
1,No cellphones allowed at Jack White's concert,0,19956178,568.4107115864754,1,0
1,"At Columbine, the cops waited outside 48 minutes. In 23 years, we've reduced that time to 40 minutes. That's what I call progress...",0,527592,419.8940449198087,0,0
1,"Sony vows to ramp up PS5 production to levels 'never achieved before' | Sony will also increase its investments in live services, PC and mobile.",0,19808773,623.2440449198087,0,0
0,Can’t say I disagree,1,2143215,296.69404491980873,0,1
1,My mom after I told her I’ve been in the hospital with viral myocarditis and could have died.,1,1350113,332.19404491980873,0,1
1,Well that and politicians,1,19034507,588.5940449198087,1,1
1,Trump loses an appeal and must testify in New York's civil investigation,0,24714017,387.7107115864754,1,0
1,Hodor,1,1125045,642.8107115864753,0,1
1,I can no longer play on my 10 year old account because Microsoft is insisting to validate an email address when none have ever been tied to the account,1,2654455,324.8440449198087,0,1
0,At least they're being honest.,1,726234,143.17737825314205,0,1
1,"The CGI wasn't improved, Disney+ just uses a little less compression, here is a comparison with the ProRes file that was used by every major media outlet that uploaded the trailer to YouTube",0,2598634,645.3940449198087,0,0
1,A colobus monkey in a depressing zoo enclosure.,1,863865,323.3440449198087,0,1
1,He’s back at it again,1,579880,463.0607293486595,1,1
1,It sucks that the store lost power for 6 and a half hours. 😔,1,2795300,681.8607293486596,0,1
1,"More footage of cops doing nothing and arguing with parents while their kids get murdered inside Robb Elementary School in Uvalde, TX.",1,4017643,641.4607293486595,1,1
1,Really don't wanna get these deaths anymore #SaveTF2,1,738373,428.76072934865954,0,1
1,[Dynamite Spoiler] Fan in the front row loses his drink. Another fan immediately hooks him up.,1,632005,202.79406268199284,1,1
1,"MerMay Octopus, me, digital, 2022",1,20686766,683.2273960153262,0,1
0,Surprise,1,2535743,215.8607293486595,1,1
1,Dog mum adopted a deer pup,0,5294637,467.14406268199286,0,0
1,"On way to work this morning. Staten Island, NYC",1,2741231,725.4773960153262,0,1
1,Tenzin da GOAT,1,239640,556.7773960153262,0,1
1,"Dolly Parton and husband Carl Dean outside their Nashville apartment, 1967",0,16043379,636.1607293486595,1,0
1,Enjoying the moment,1,11459889,573.2440626819929,0,1
0,"Eesh even in disaster, you can find a cash grabber",1,1700973,324.8273960153262,0,1
0,I'm in pieces after that workout,1,384673,321.8273960153262,0,1
1,"As the Netflix live action version gets closer and closer, remember to be nice to the staff actors - especially the child actors. This is just a job and not life or death. Plus, there's this message from Iroh:",1,1118740,550.8607293486596,0,1
1,How to Murder Your Husband writer found guilty of murdering husband,0,20918259,705.8273960153261,0,0
1,A group of future service dogs,1,826607,598.6273960153262,0,1
1,anime_irl,1,2023193,375.0607293486595,0,1
1,Advanced NASUS abusing technique,1,5852484,711.5440626819928,1,1
1,It will always be cooler than the other two... literally.,1,3858034,426.0440626819928,0,1
1,What happens when you subscribe to Ina,1,767480,660.7774126847585,0,1
1,Scientists can now grow wood in a lab without cutting a single tree,0,16167126,424.1774126847585,0,0
1,"Apparently the ""Good"" guys with guns are cowards. The police aren't there to protect, they are there to look good and take 40% of the city's budget.",1,545755,570.8774126847585,1,1
1,2meirl4meirl,0,1379188,758.6940793514252,0,0
1,Hank fucked Ted,1,97617,561.2107460180919,0,1
1,"Epic Games has released ""The Bioshock Collection"" for free",1,32947830,516.3440793514252,1,1
1,Anon dislikes a pregnant coworker,1,886564,604.0107460180918,0,1
1,couiours gorge teh monekr,1,2802152,522.7940793514251,0,1
1,Exactly!,1,1955444,666.8440793514252,1,1
1,When he's super tired after walks he has a tendency to wilt,1,1903017,687.0440793514251,0,1
1,Some fuckcars content on insta this morning,1,236562,415.4440793514252,1,1
1,SLPT: Someone shooting up your school? Call 911 and report someone selling loose cigarettes.,0,1630784,498.06074601809183,0,0
1,And countless Republicans actually listen to what she has to say…,0,6275383,647.7274126847585,1,0
1,Why does Facebook only blame the Right?,0,572995,737.8107460180919,0,0
1,"TIFU by losing 100k, possibly job",0,356434,567.9940793514252,0,0
1,"Man Carries Gun Onto Arlington Elementary Campus, Accidentally Shoots Self in the Foot",0,21405632,242.1274126847585,0,0
0,It can always go lower,1,465093,423.2274126847585,0,1
1,cursed_butt,1,3211055,476.6107460180919,0,1
1,Leave me…. I can’t go on!,1,4812820,584.1107460180918,0,1
1,An analysis of fossilised faeces suggests that the people who built Stonehenge ate raw cattle and shared the leftovers with their dogs.,0,27543080,848.0274281819661,0,0
0,When you make a bathroom so pretty you kind of want it as a wallpaper,1,1081762,294.2940948486328,0,1
0,anya minding her own business,1,2101615,413.7372001926104,0,1
1,Fuck Bulgaria,1,833266,587.6372001926104,0,1
1,this has gotta be the funniest post wisdom teeth removal vid,1,895876,233.6538668592771,0,1
1,Any other caption and I wouldn't have thought this was a sad cringe moment,1,1211898,400.7538668592771,0,1
1,It's morbin time 🦇,1,786842,625.8872001926104,0,1
1,Kevin Spacey charged over sex attacks,0,1917543,536.053866859277,0,0
1,"TIL that possums don’t “play dead”, they actually pass out due to fear of predators. They go into shock and faint when confronted, involuntarily. They are in a catatonic state until they become conscious again.",0,27691579,565.1872001926105,1,0
1,About a dozen people run a railroad crossing,1,3747271,410.0705335259437,1,1
1,Having programming as a job vs. programming as a hobby,1,1995377,657.1872001926105,1,1
1,One Piece: Chapter 1050,0,1106310,85.82053352594376,0,0
1,So much love right there,1,31221419,472.8372001926104,1,1
1,Pretty Awesome Art by Edson Aurélio Hudson,1,1451578,613.9205335259437,0,1
1,[Valtteri Bottas] Saved the last print for my buddy @LewisHamilton,0,2129505,325.4705335259438,1,0
1,"🔴Daily Reverse Repo Update 05/26: $2,007.702B - BUY HODL DRS🔴",1,787345,385.7372167944908,1,1
1,"I'm Muggsy Bogues, former Starting Point Guard for the Charlotte Hornets. AMA!",0,4796982,400.1705501278241,1,0
1,The massacre hidden by the US governament,1,718874,467.8872167944908,0,1
1,"Never, ever give up guys.",1,3474755,715.2372167944908,0,1
1,Grinding 24/7,1,6812460,320.4038834611575,0,1
1,"Albert, the physics teacher - Can manipulate physics at will",1,1282066,689.9205501278242,0,1
1,Parrot goes berserk on a man who stepped on its cage,1,871639,296.2038834611575,0,1
1,Crimes against Cartography,1,344983,426.2872167944908,0,1
0,"If you’re looking for me, I’ll be sitting directly in your face.",0,230399,463.8038834611575,0,0
0,We in this sub have all definitely been here,1,1856341,470.5872167944908,0,1
1,"Please, Dr.War was my father",1,94774,336.10388346115747,0,1
0,Grandpa can't help himself.,1,2046542,399.57055012782416,0,1
1,Scott Morrison instructed Border Force to reveal election day asylum boat arrival,0,890544,275.6205501278242,0,0
1,"Buried my cat with a small shrub two years ago. Haven't touched it except to pet it once in a while and call it a good kitty. I looked out the window today. Cat has returned, it seems.",1,618293,524.1705501278242,0,1
1,Retribution of Issac ‘MF’ Wright,1,5075269,196.8372167944908,1,1
1,Playing on a beach can be dangerous,1,1569153,698.2205501278241,0,1
0,"Some surviving scenes from the first pro-gay film, Different from the Others (1919), which was burned by the Nazis",1,343858,289.32055012782416,0,1
1,Shoutout to JeffHill from valve for actively checking reddit and fixing bugs,1,1073362,661.3872167944908,0,1
1,We don’t matter to them,1,752521,358.30388346115745,0,1
1,Roger Roger,0,2082972,404.2039001425108,1,0
1,Lol,1,124588,399.4872334758441,0,1
1,Trauma x ADHD = Swiss cheese memory,1,350698,790.0039001425107,0,1
1,The chatter is picking up,1,12178825,570.6705668091774,0,1
1,Professional driver does professional driving,1,1879113,440.0205668091774,0,1
1,This took entirely too long to figure out how to make,1,1371884,623.8039001425108,1,1
1,Amber Heard just admitted that the Op-ed was for Johnny Depp,0,46897,462.65390014251074,0,0
1,"I mean, just look at it",1,1061609,227.15390014251076,0,1
1,Man is caught playing with microphones,1,4287642,754.9705668091774,0,1
0,Squishy boi in his natural habitat,1,3808531,560.487233475844,0,1
1,A new generation is reviving unions. The old guard could help,0,546774,474.8872334758441,0,0
1,Took me almost an hour to make this meme on photoshop:,1,669325,585.2705668091774,0,1
1,Perspective.,1,1745118,384.937233475844,0,1
1,Genshin animated: Smug gambling addict robs elderly man of his life savings,1,1479729,736.9705668091774,0,1
1,Transgender kids are all right,1,900154,679.5039001425107,0,1
1,You sure?,1,545742,704.7705668091774,0,1
1,this table haunts my nightmares,1,1679370,310.68723347584404,0,1
1,[OC] Animated Susie hugging Kris,1,215452,542.637233475844,0,1
1,10 years later...,1,871091,836.3539001425107,0,1
1,Two Boeing B-29 Superfortress,1,1012645,401.2372334758441,0,1
1,ELI5 How do worms dig their tunnels if their body is soft?,0,20634012,509.2539167324702,0,0
1,This is the way.,1,13358556,504.3872500658035,0,1
1,[comic] what haunts you?,1,744975,651.7205833991369,0,1
1,"What are you doing, mister?",1,310410,621.2872500658035,0,1
0,"McDonald's gets rid of their mascot, 2011",0,1068281,634.4539167324702,0,0
0,Dorian Gray (OC),1,14580738,282.1539167324702,0,1
1,"Saved a kitten from drowning, since then he licks me non-stop and generally thinks I'm his mom 😄",1,3524071,360.3705833991369,1,1
1,Karen goes to charging station to rant about Tesla owners,1,299302,491.8705833991369,0,1
1,Face masks,1,1600052,821.8372500658036,0,1
1,🚬🗿,1,747146,742.7872500658035,0,1
1,Double standards,0,1512049,751.2205833991369,1,0
0,he’s trying his best ouchie :( (oc),1,858194,535.1372500658035,0,1
0,"Please forgive me, Aqua-sama. I swear this is just a meme.",1,287445,429.4205833991369,0,1
1,There is no doubt this man’s stock in Hollywood has shot up.,1,344328,497.2372500658036,0,1
1,Be cool to put things in locked chests,1,996432,442.7039167324702,0,1
1,Yet another human attacked by pitbulls,1,112528,687.7872500658035,0,1
1,finally i made a good use of the passive,1,2079432,228.8539167324702,0,1
1,Man pulls woman from the ledge of the Golden Gate Bridge,1,867071,229.58725006580352,0,1
1,"pAndorA's BOX oPenEd, eVIL Is ReLeaSeD Upon the eARth",1,1810045,700.5705833991368,0,1
1,Ich🧠iel,0,423295,352.97058339913684,1,0
1,I had no idea rabbits could swim!,1,9711514,528.1705833991368,1,1
1,🙄,1,402249,734.5705833991368,0,1
1,What is up with the police handling of the Uvalde elementary school shooting?,0,2889175,239.7039167324702,0,0
0,That's one way to win....,1,379871,683.7539333860079,0,1
1,Es geht nach Sylt!,1,626743,683.5039333860079,0,1
1,It's morbin time,1,1623182,588.6706000526746,0,1
1,Strippers say a recession is guaranteed because the strip clubs are suddenly empty,0,4099272,653.9706000526746,0,0
1,"In a Garand Thumb voice: ""As cool as owning all this gear is, it won't be any good if you just stand outside and do nothing with it. So go get some training.""",1,178210,446.38726671934126,0,1
1,"Sex and prosperity: nothing we can do will make the world more free, fair and prosperous than giving women control over their own bodies",0,16680053,427.403933386008,0,0
1,Made a guy a burger. He wanted a picture of me and my ukulele. But he also wanted the burger in The photo. This is my job.,1,491657,179.23726671934128,0,1
1,"LPT: If you are afraid of taking no for an answer or being rejected. Remember that you have nothing to lose. You can only win. If you are rejected, you are at the same point as if you had never asked.",0,20590931,771.4872667193413,0,0
1,local rock station,1,1165716,310.753933386008,1,1
0,If you like it then you shoulda put a ring on it.,1,917058,686.353933386008,0,1
1,🔥 Guianan cock-of-the-rock,1,6837886,461.4872667193413,0,1
1,Ted Cruz Storms Out on British Interviewer When Asked Why School Shootings Only Happen in America,0,8061245,610.3206000526746,1,0
1,"Reminder that the GOP was Far-Left at the time of it's creation, & how radically different the past really was from how we imagine it",1,498354,268.8372667193413,0,1
1,ummm.....,1,557619,680.0706000526746,0,1
1,Parents begged police for upward of 40 minutes to stop Texas school shooter: Report,0,965840,750.7706000526746,0,0
1,Forbidden Lego,1,548563,518.203933386008,0,1
