target,title,is_reddit_media_domain,subreddit_subscribers,post_age_min,is_successful_subreddit,is_successful_domain
1,Their existence is morally wrong and dumb when our labor is so exploited.,1,1956491,243.13216441075008,1,1
1,has anyone ever lost the ability to read?,0,20922095,550.2654977440834,0,0
1,"POV: It's 27th may of the year 6522, you are playing new hyper smash bros true ultimate warfare deluxe definitive challenge edition & knuckles, new funky mode, your'e choosing a character to fight to cpu, but you don't know what character to select due to ""everyone is here"" massive character roster.",1,455273,500.0654977440834,0,1
1,L religion,1,835135,669.2154977440835,0,1
1,"Brushing for my chonk, Tobby",1,588532,873.0654977440834,0,1
1,"A ctivist ""Charleston White"" brags about raping white women & killing white men.",1,610672,641.9654977440835,0,1
1,OH NOOO!1!1! HES LATE!1!1,1,871216,398.3154977440834,0,1
0,Old meme new template,1,222795,696.28216441075,0,1
0,Poptart meets the air conditioner,1,154787,498.3154977440834,0,1
1,Of snakes,1,1152288,739.2321644107501,0,1
1,“Ooh he a rapist...” “I want me some of this”,1,873911,656.4654977440835,0,1
0,"lost kidney, that's horrible... anyway",1,5359506,179.13216441075008,0,1
1,"Few days ago Putin visits wounded soldiers, one of them, by a strange coincidence, happened to be also a factory worker he previously met. And that's not the first staged meeting with ordinary people.",0,353707,922.4988310774168,0,0
1,A trip to the movies (By @TinaFate1),1,167395,825.5488310774167,0,1
1,Togashi is now the most followed mangaka on twitter surpassing horikoshi!,1,573072,601.4988310774168,0,1
0,guess who's back....back again,1,1343109,382.0654977440834,0,1
1,Reminder that there are people who are justifying a political genocide against You for your beliefs.,1,966422,134.83216441075007,0,1
1,"[OC] After 1100 hours of maining Horizon, I became Horizon.",1,2080559,420.4821644107501,0,1
1,Large Ferry passes right over freediver's head,1,462915,584.7654977440834,0,1
1,"Poster touting one of the many ways you can electrocute yourself, 1932",1,454591,693.2488310774168,0,1
0,"In temporarily occupied Kherson, a local resident plays the anthem of Ukraine on the street, and passers-by actively support him with money. (Source: https://twitter.com/antiputler_news/status/1530163233461526528)",1,728169,454.6988310774168,1,1
1,He probably should also search Webster’s for “absolute.”,1,1034123,713.3154977440834,0,1
0,"Stop right there, criminal scum",1,600097,417.4321644107501,0,1
0,Blessed Cupcake.,1,1014843,870.8321644107501,0,1
1,So true elon 😔,1,1015544,488.78216441075006,0,1
1,"Tatay ko: ""Bakit ka ba nagmomoisturizer, bakla ka ba?""",1,861112,569.3321644107501,0,1
1,My respect for Liverpool 📈📈📈,1,121705,295.2654977440834,0,1
0,change is in the air,1,108631,451.8154977440834,0,1
0,a new mall opened up nearby me,1,423119,330.7654977440834,0,1
1,Huge protest outside of the NRA convention in Houston. It's growing by the hour. There's gonna be more protesters than attendees.,1,4019704,148.88216441075008,1,1
1,NOFX - The Idiots Are Taking Over [Punk],0,29729807,351.3654977440834,0,0
0,Thought this fit here,1,506089,342.08216441075007,0,1
0,Cypher: Setup Split A (Heaven and Mid A),1,1369402,421.03216441075006,0,1
0,"""That guy can't even set the steam engine right""",1,283959,272.6654977440834,0,1
0,bad boy life,1,350740,371.58216441075007,0,1
1,Waiting in line to get gas that was less than a dollar,1,1003154,502.0488310774168,0,1
1,Finally got myself a PS5!,1,642944,304.33216441075007,0,1
1,She hulk fanart,1,1693953,493.9488310774168,0,1
0,they made it feelsstrongman,1,259143,363.6154977440834,0,1
1,The Fed’s favorite inflation measure rose 4.9% in April in a sign that price increases could be slowing,0,2205233,383.3654977440834,0,0
0,Sometimes you have to let the last few crumbs go,1,903860,428.33216441075007,0,1
1,Kral şirket,1,373721,363.9988310774168,0,1
0,That's not suspicious at all ....,1,1141744,500.6154977440834,0,1
1,"Oh yeah, baby.. spread that mayo.",1,40798646,373.9821644107501,1,1
1,I made a Plugin to quickly launch/add Non-Steam Games without needing Desktop Mode!,1,122782,273.44883107741674,0,1
0,This little Barred owl was posted on fb by Hope for Wildlife with a dislocated elbow. He will recover completely.,0,397052,350.1488310774168,0,0
0,"Ayo Mr White, going dark",1,1541532,348.8821644107501,0,1
1,Don’t know if this counts as nuked because of the audio or not,1,394487,414.2654977440834,0,1
1,Creepy little thing,1,743756,630.5488310774167,0,1
0,i procrastinate going to sleep but i also procrastinate waking up,1,167472,345.1654977440834,0,1
1,"Nope, not broken. I feel bad for the pavement though.",1,431503,551.3821644107501,0,1
0,this is how this subreddit acts,1,932514,461.7988310774168,0,1
0,"""Chie... Where's the door hole?"" (Art by OmniformBlue)",1,162011,158.24883107741672,0,1
1,Loved how I entered this fight thought I’d share.,1,1373341,386.39883107741673,1,1
1,Royal Never Give Up vs. Evil Geniuses / MSI 2022 - Semi-Final / Post-Match Discussion,0,5854056,583.4154977440834,1,0
1,This is my plea to change the door at the Varrock chapel,1,649793,492.64883107741673,0,1
0,[Media] Long haired Rem (art by D2ON),1,187671,460.7988310774168,0,1
1,[Canucks on Twitter] Sending our love to the Boeser family 💙,1,89652,250.73216441075007,0,1
0,sErVe aNd pRoTeCt,1,135269,333.58216441075007,0,1
1,They Were Afraid Of Getting Shot At...,0,545826,155.43216441075006,1,0
1,Hector is underrated.,1,147879,493.7488310774168,0,1
1,"King of Devotion, me, digital, 2022",1,20690847,516.7321644107501,0,1
0,The King of L.A,1,462759,312.78216441075006,0,1
0,One of these...is not like the others.,0,310879,503.9821644107501,0,0
1,hell yeah,1,1601157,383.14883107741673,0,1
1,[self] my Mina Ashido cosplay I made,1,1304115,566.9988310774168,0,1
1,Dragon Ball Super: Super Hero New Trailer!,1,569806,379.9321644107501,0,1
1,The culmination of buying shit and replacing that shit with slightly better shit.,1,727402,473.64883107741673,0,1
1,Fabrizio Romano on Twitter “It has never been in doubt”. Spurs sources have been confident for days and it’s now decided: Antonio Conte will be Tottenham manager for the next season.,0,112969,333.08216441075007,0,0
0,Decorated my graduation cap and wanted to share :),1,1119001,245.28216441075008,0,1
0,Aqua and Kairi [art by kumanakris],0,265540,397.0988310774167,0,0
1,LPT: Raise your hand to admit your mistake if you make a driving error. The huge majority of the time it will diminish any potential road rage from the other driver.,0,20596615,231.9321644107501,0,0
0,Michelin's Biggest Tire & Smallest Tire,1,381389,218.29883107741676,0,1
1,Tile artist,0,3643761,444.08216441075007,1,0
1,Stop it,1,5629335,723.4488310774167,1,1
0,PsBattle: sleeping elephants,0,17971199,784.3654977440834,0,0
1,dispenso título,1,33111,429.6821644107501,0,1
0,I'll just leave this here. Don't ask me for the sauce...I don't have it.,1,136432,279.9654977440834,0,1
1,No need to check every year,1,128325,801.5154977440834,0,1
1,"Russia’s foreign minister, Sergei Lavrov, accused western countries of waging a “total war” on Russia and its people and culture.",1,426460,587.5988310774168,0,1
0,Point of No Return,1,426691,390.7321644107501,0,1
0,"Struggle is necessary, no matter what you do!",1,669292,305.0488310774168,0,1
0,This is my ‘Rebirth’ piece. Drawn freehanded and coloured. I hope you all like,1,3925683,463.4488310774168,0,1
0,"Of all the “exquisite corpse” duets I’ve seen, this is the most impressive.",1,124459,356.7154977440834,0,1
0,It’s pretty accurate,1,77815,266.0654977440834,0,1
1,Clearly his son,1,6277646,499.2321804086368,1,1
0,"If you can’t beat them, join them",1,3090541,340.0821804086367,0,1
0,"in, in, out. no wait...",1,2143512,181.16551374197007,0,1
1,Our republican parents don't understand the long term consequences of their actions,0,13358754,318.4155137419701,0,0
1,Tots and prayers,1,154402,439.3988470753034,0,1
1,HMRB while I pass under the bar with an anti-gravity-spinning-bike-stunt,1,980978,735.6488470753034,0,1
1,Vietnam <3,0,3751012,550.2988470753033,1,0
0,"""This Is Exciting! Who's Getting A Bath???""",1,596461,629.9488470753034,0,1
0,Summon bigger fish,1,360098,282.81551374197005,0,1
0,Getting some helpful information from Spider-Man's biggest foe,1,491987,291.2274569153786,0,1
0,Pillar of Shame in University of Oslo's garden,0,610045,275.84412358204526,0,0
0,suddenlybi,1,90578,369.7607902487119,0,1
0,Now I can ride the waves with my favorite monster!,0,535803,148.8107902487119,0,0
1,"The Tower of Orthanc, Isengard [OC]",1,365334,691.8107902487119,0,1
1,Father defends his wife and child during shootout with robber,1,97418,280.7774569153786,0,1
0,Slowly growing,1,414406,382.3941235820452,0,1
0,Then vs Now,1,216815,758.1607902487119,0,1
1,"[Request] r/trebuchetmemes <> r/politics crossover: Specs of a trebuchet (height, arm length, counterweight mass, etc) to launch my body (~75kg) at Mitch McConnell's office from 300m away",1,1167212,923.5274569153786,0,1
0,Added a fourth wiener to the pack. Meet Professor Sherman,0,281012,153.44412358204525,0,0
1,India vs Pakistan,1,836116,564.3607902487119,0,1
0,This journalist went to cover a story about dogs in animal shelters and one affectionate dog hugged his leg and wouldn't let go. The journalist couldn't resist and adopted him!,1,742706,547.9441235820452,0,1
1,Don’t let his little face fool you…he is a criminal. Let me introduce you to Meatball.,1,786790,270.3941235820452,0,1
1,ayo what,1,161084,656.4274569153786,0,1
0,Found this as I was losing my faith in humanity,1,219959,412.9774569153786,0,1
0,This show is insane,1,98163,304.2774569153786,0,1
0,fauners nooooo 😭😭😭😭,1,36959,433.92745691537857,0,1
0,1973 PLYMOUTH CUDA [750x850],1,1585676,417.0107902487119,0,1
0,Marianne's three hopes moveset looking good,1,85322,365.7774569153786,0,1
1,On this day in 2017...,1,235094,497.3607902487119,0,1
1,Taco Bell Mexican Pizza: Is it even a Mexican Pizza if half of it hasn’t slide to the side?,1,2051160,157.64412358204524,0,1
1,This hunting story about a deer,1,1058034,516.0274569153786,0,1
1,Fire Emblem Warriors: Three Hopes – Leicester Alliance trailer (Nintendo Switch),0,286512,396.42745691537857,0,0
0,Two sneaky good bois- I love making couples’ dogs,0,186391,483.59412358204526,0,0
1,Lmao dumb question but has this ever happened before?,1,1013000,840.0941235820452,0,1
0,shit hurted,1,381919,114.42745691537856,0,1
1,mcdonalds altercation,1,271248,473.8107902487119,0,1
0,the resemblance is uncanny,1,100713,605.5607902487119,0,1
1,Who’s the most powerful biotic?,1,324197,355.7607902487119,0,1
1,80s Aerobics video to the tune of Rob Zombie's Dragula,1,5082622,385.84412358204526,1,1
1,Hack That Will Change Your Life,1,7323639,315.8941235820452,0,1
1,My animal crossing 🐥🐰🐶🐸 ❤️,1,1760136,447.5607902487119,0,1
1,Finally someone says it,1,181503,432.42745691537857,0,1
0,Under the bell by pdugf,1,589169,495.9774569153786,0,1
0,WOW! WOW! WOW! Moment.,1,376610,310.29412358204524,0,1
1,Nice guy borderline incel with this terminology,1,1476862,463.9774569153786,0,1
0,I am spoiled completely...,1,2216760,369.0274569153786,0,1
0,Si,1,35095,195.84412358204523,0,1
1,Granny doesn't approve. 1940's.,1,633679,688.7941235820452,0,1
1,"Men that struggle with suicidal thoughts, what's on your list of reasons to keep living?",0,3791436,360.96079024871193,0,0
1,Triggered by a 9 yrold,1,1333553,971.6941235820452,0,1
0,The day we brought him home and then today (five months later). He's grown so much!,1,1012041,290.92745691537857,0,1
0,"Artist: Kime -Lighthouse Professional Tattoos, Seoul Korea",1,4852006,399.07745691537855,0,1
1,2meirl4meirl 🎈,1,1379624,891.3607902487119,0,1
1,I can’t even…,1,782858,243.1607902487119,0,1
1,"The more you drink, the more water you use",1,1079078,784.6774569153786,0,1
1,"4 top comes in at ten to closing, think it's ok since they ""just want something small""",0,470815,235.9107902487119,0,0
1,Is this a new one?,1,2047226,899.9941235820453,0,1
1,Governor saw deadly arrest video months before prosecutors,0,24718732,289.6107902487119,1,0
1,Angels Shohei Ohtani pumping fist after winning a dugout competition (via Japanese TV),1,1952263,223.94412358204525,1,1
1,[Saloondria] A Simple Guide to Dangerous Potions and Safe Alternatives You May Encounter in the Magical Wild West.,1,897799,456.09412358204526,0,1
1,“Poor lady. Too bad she lost the light in her eyes when she left the church”,1,238500,327.42745691537857,0,1
1,I much prefer to be surprised rather than be spoiled,1,1942716,485.1941235820452,0,1
0,Found this on Instagram.,1,240320,329.82745691537855,0,1
1,"Che Guevara in Cuba, 1957.",1,399152,389.6441235820452,0,1
0,Blursed_Lyrics,1,183093,428.07745691537855,0,1
0,I kinda expect my randoms to be good if they have expensive skins and heirloom,1,362958,627.3107902487119,0,1
0,Greece not christlike,1,640548,683.2107902487119,0,1
0,wrong side but still cozy,1,364636,657.3274569153785,0,1
0,A long boi giving me a long talk after not seeing him for 2 days,1,349847,381.0107902487119,0,1
1,Why is it a common trope that people cut their palm when they want to use thier blood? Wouldn't that the be the place where you would least want to have a deep cut?,0,2724504,365.5107902487119,0,0
1,gavin and his friend,1,344065,464.34412358204526,0,1
0,"""Ten Years Later"" by Alex Raebits",0,42092,544.5941235820452,0,0
1,Australians don't have sex,0,5751217,908.010790248712,0,0
0,Vultures vulturing.,1,371668,245.92745691537857,0,1
1,Salesforce staff want to cut NRA ties after Uvalde shooting,0,479793,290.6107902487119,0,0
1,"Self proclaimed ""White Supremacist"" from the ""Aryan Nation"" demands that Donald Trump be called, slaps lady.",1,1880143,559.5774569153785,0,1
0,Why? Just why...? [MEME],1,370342,510.96079024871193,0,1
0,Ah..Good times,1,868320,816.8607902487119,0,1
1,Final Polls are in Folks. We're calling it here first.,1,534881,446.92745691537857,0,1
0,Neko Kobayashi is so adorable.,1,83156,358.7274569153786,0,1
0,I'm not good at goodbyes. Well nobody is.,1,276354,386.32745691537855,0,1
1,"Carnival Freedom cruise ship catches fire in Grand Turk. May 26, 2022.",1,1654384,1160.1441235820453,0,1
1,Ozzy Osbourne,1,14581346,206.22745691537855,0,1
0,The patriarchy is a death cult.,1,238884,469.8607902487119,0,1
1,Thought I’d share my garage sale find. $100 for approximately 2500+ good balls. From someone who backs onto a dogleg and collected them from their yard over seven years.,1,479172,463.5274569153786,0,1
1,"Took a modest pay cut to move to Cornwall, 6 weeks before 1st lockdown. Totally worth it. Ten minute walk from old front door v ten minute walk from current front door.",1,1076671,341.8107902487119,1,1
0,Stella smiles...,1,3813390,270.32745691537855,0,1
1,Mauler and Rush of Hot 89.9 are total scumbags,0,213460,709.3774735927582,0,0
0,What do you mean?,1,19049175,278.39414025942483,1,1
1,"""My marriage is over"" a very long sad tale about a woman discovering a monster.",0,357240,472.6274735927582,0,0
0,"""Hit it hard""",1,278361,384.02747359275816,0,1
1,female animation in video games,0,94928,717.3441402594249,0,0
1,found one of this,1,1829787,361.6941402594248,0,1
1,New Card Revealed - Neptulon the Tidehunter,1,1867307,155.54414025942484,0,1
1,"A fishing story, ""It must have been a gargantuan fish """,1,1219404,515.9274735927581,0,1
0,Making a meme of every quote from Spider-Man: Day 1130,1,392824,511.5941402594248,0,1
1,Me_irlgbt,1,240542,807.7941402594248,0,1
0,An interesting title,1,54563,727.4274735927581,0,1
0,"Yesterday, all my troubles seemed so far away",1,72046,260.02747359275816,0,1
1,This has to be the weirdest part of the game.,1,833930,462.4441402594248,0,1
1,H E I S T,1,126848,389.5608069260915,0,1
0,The hidden cost,1,719316,273.1108069260915,0,1
0,"what, a jerk",1,162814,335.3774735927582,0,1
0,[AI] You do not recognize the bodies in the water,1,638809,151.46080692609152,0,1
0,n,1,164306,649.4274735927581,0,1
0,What's next? Whispering promises? False Guillotine?,1,745239,551.2774735927582,0,1
1,Building up my party supplies,1,383312,408.9697597384453,0,1
1,When you've had it with all the sniping in the new map.,1,1246329,791.936426405112,0,1
1,"Say what you will about Phantom Menace, it had an amazing Teaser Poster",1,2229887,332.38642640511193,1,1
1,Self explanatory,1,62608,556.9697597384453,0,1
0,"As is often said, Memento Mori.",1,96451,321.51975973844526,0,1
1,Amber's council coming out to give a closing statement:,1,49020,345.3030930717786,0,1
1,Water Doggo,1,1904374,907.736426405112,0,1
1,"Edinson Cavani farewell interview: “I really am very grateful, and I’ll be leaving here with a happy memory of that affection they [United supporters] showed me and always displayed.”",0,368216,434.186426405112,0,0
0,Color of Morbius,1,179179,148.4197597384453,0,1
1,Reality has become worse than the parody,1,125615,435.5530930717786,0,1
1,"are they like us, or are we like them?",1,2339422,852.236426405112,0,1
1,geometry dash lite has been updated,1,95684,288.2197597384453,0,1
0,Pokemon fans having children,1,1165984,377.26975973844526,1,1
1,Those bois taking down BTRs in peak fashion 👌🏽,1,178312,412.51975973844526,0,1
1,"Valve, please overhaul your Particle System and Slark Passive. They are the main reason most of the hacks that exist for the game are working.",0,1074041,530.3530930717786,0,0
1,[OC] age is just a number,1,1831625,420.2197597384453,0,1
0,phoenix dont put yourself down like that man,1,726592,514.3530930717786,0,1
0,more evidence unearthed,1,443824,983.386426405112,0,1
1,Return of the hunt,1,2105286,475.6697597384453,0,1
1,For capturing this epic trick shot in one take.,1,1021823,1064.6697597384452,0,1
0,look at my process to make this puppy in pixel art :),1,633504,799.2530930717786,0,1
1,Candy Loving 1979,1,16050317,602.0197597384453,1,1
0,"Today is the 80th anniversary of Reinhard Heydrich assassination by two Czechoslovak paratroopers, highest ranking nazi official in Protectorate and principal architect of the Holocaust",0,3135472,316.5864264051119,0,0
0,Probably,1,142715,553.8030930717786,0,1
0,those words couldnt get any wiser,1,822028,460.0030930717786,0,1
1,This sign is about two hundred yards from my daughter's school.,0,202963,446.6030930717786,0,0
0,Answers to the questions on my previous post : it works with batteries and yes it can still be used without the motor.,1,1045919,500.26975973844526,0,1
1,TIFU: by thinking peanut butter was supposed to be spicy,0,17961926,218.9030930717786,0,0
0,Checkmate 😎,1,385180,527.3031088471413,0,1
1,x̵̛̝͎̪̠̱̓̾͐͌̾̇͗͝g̵̠̤̯̞̾̔̔͗̐̓̈́̈́͐́͝͝͠j̵̹͕̘͍̘̮̯͙̱̥͌͑̊̃͗̓̌͜͝a̸̺̟̳̲̹̮̰̜̮̩͓̋̎͑̈́͆͐͛͌͊̍̀͂͂́̔k̸̨͓̹͍͎͈̟̟̭͓̾̋̽̒̍̋̔̒͜͝͠ä̵͚͚̼̣́̽̎̃̐͒̎͘̚͠ķ̵̡͈̥͙̲͎͓̩̙͔̰̙̳̚ͅè̶̳̣̱̰̼̘̦̭͒̔̐͌͆̍̾̍̋̒͒̀͛̂ͅñ̸̝͚͚͔̗͇̪̩̏̂̾͑͘͝s̸̢̙̝̲̞̖͋͂̇̀͂̔̀͜n̶̨̢̧̺̮̮̜͐̊͂̅̈́̅͌͆̓͜v̷̨̼̜̦̙͍͖̬̬̬̮̫̲̥̓̏̑͑̾́͊̚̚ȩ̴̧̢͇̪̣̲͔̞̟̳̖͒͝,1,839257,1038.4031088471413,0,1
1,"If the article isn’t in-deletion, I will not read to completion",1,208066,413.95310884714127,0,1
0,egg⚡irl,1,255490,681.1531088471413,0,1
1,Be free to like things,1,352721,1010.3031088471412,0,1
0,nice,1,821881,244.86977551380792,0,1
1,I'm a biologist and love to draw Pokémon anatomy for fun! Here's my nightmare-fuel take on Tyranitar [OC],1,4040191,254.5531088471413,0,1
0,Give me all your biscuits!,1,316123,323.8864421804746,0,1
1,Ginyu force banner dropping in a few days!!! GET HYPE!,1,223979,355.6864421804746,0,1
0,Inventory management,1,284132,367.95310884714127,0,1
0,VERCETTI!! Remember The Name!!,1,32956651,303.9197755138079,1,1
0,"There are two wolves, inside two wolves, inside two wolves, inside two...",0,353182,336.0364421804746,0,0
1,A puddle in my garden that looks like Cosmo Kramer,1,264132,492.2531088471413,0,1
0,Tucked it away,0,1126570,491.8031088471413,0,0
1,I KNOW THAT YOU CAN DO IT,1,272751,452.1031088471413,0,1
0,….,1,94593,180.7364421804746,0,1
0,I made a pin,1,199343,236.31977551380797,0,1
0,he fu**ed up his face,1,382622,268.85310884714124,0,1
1,Indiana teacher hits student,1,260044,426.5031088471413,0,1
1,"Edinburgh Castle at a distance seen from the rain drenched vennel steps lit with street lamps, Edinburgh, Scotland.",0,1008156,962.4864421804746,0,0
1,Firefly is a subpar show and deserved to be canceled.,0,2546478,118.45310884714128,0,0
0,true love,1,215819,447.3531088471413,0,1
1,The silhouette in the ice cube looks like a Disney princess,1,19962466,847.5364421804746,1,1
0,This is me rn,1,61492,416.7197755138079,0,1
1,"[Chris Medland] Ricciardo asked about comments from Zak Brown about his time at the team not living up to expectations, says he's not wrong and adds: ""My skin is tanned, beautiful and also thick""",0,2131310,720.1531088471413,1,0
0,[Karcher],1,308576,322.70310884714127,0,1
1,My family cosplay at San Diego Comic Con back in 2014,1,284324,860.4364421804746,0,1
0,This department stores accessible lift is up a set of stairs.,1,2923022,302.8364421804746,0,1
0,meirl genocide run,1,383269,391.45310884714127,0,1
1,"TIL in 1955, actor Ray Liotta was adopted from an orphanage at the age of six months. He hired a private detective to locate his biological mother in the 2000s, and learned that he had one biological sister, one biological half-brother, and five biological half-sisters.",0,27699786,843.1531088471413,1,0
1,"Chris Jericho on working with new talent as opposed to wrestling veterans in AEW: ""This is not the fucking nostalgia hour. This is about continuing to strive to evolve, build, and make new stars""",0,632153,348.2531088471413,1,0
0,Hell hath no fury like Nick Fury,1,462688,140.1864421804746,0,1
0,Wingless Goose,1,253373,232.36977551380792,0,1
0,Mild Suggestive Themes,1,153617,135.2364421804746,0,1
0,The Doom Slayer is with us! (id tech tweeted in support of us),1,739479,395.8531088471413,0,1
0,Capyburger,1,86591,342.15310884714125,0,1
1,"""Gays and betas are caused by the devil and I'm an alpha!"" Risked my life by poking the bear",0,1232523,232.4864421804746,0,0
0,gonna leave this here,1,142818,298.2864421804746,0,1
1,"Weed fam, y’all made it to Friday! Smoke up!",1,746689,532.9864421804746,0,1
1,"If I had the cards, I'd do it",0,86011,335.0364421804746,0,0
0,Spoof shirts were my favorite then,1,822553,255.21977551380795,0,1
1,Keep shrinking that tent,1,61559,232.85310884714127,0,1
0,Mariusz Pudzianowski wins the Power Stairs during the 2008 World's Strongest Man contest,1,20212029,137.2864421804746,0,1
0,Wait what,1,897544,522.919775513808,0,1
0,Every time Jeremy rolled his Reliant Robin,1,255456,541.8864421804745,0,1
0,Annoyed zebra tries to chase down a young leopard.,1,2329919,189.0531088471413,0,1
0,Root Systems of Prairie Plants,1,66907,483.40310884714125,0,1
1,"As of today, May 27th, 2022, In Rainbows is as old as Pablo Honey was when In Rainbows came out:",1,256136,363.119775513808,0,1
0,When something broke at home and mom asked me to fix it,1,1190474,853.1197755138079,0,1
1,Is this true???,1,900513,569.3864421804745,0,1
0,Chad vibing to the music,1,206732,664.2864421804746,0,1
0,"Found something that works better than HRT, a good camera angle",1,282830,543.1197755138079,0,1
1,/tv/ on what women like,1,1264314,714.1531088471413,0,1
1,When this feature comes what music will you be playing?,1,326805,278.3364421804746,0,1
1,The Disappearance of Oscar Zeta Acosta (Dr Gonzo from Fear and Loathing in Las Vegas) (2022) [00:17:09],0,19812093,478.0364421804746,0,0
1,Lets hope things turn out better for you brother.,1,330436,1022.219775513808,0,1
0,Real life phantom thieves,1,353513,586.0531088471413,0,1
1,Story of every Visegrader 😔,1,37940,647.8031088471413,0,1
1,Remains of a soldier who died in the battle of Visby 1361. [3024 x 4032],1,2438576,861.2031088471413,0,1
1,sajish,1,212300,298.86977551380795,0,1
1,PARTEI-Spitzenpolitiker bezahlte Minderjährige für Sex,0,627096,304.6864421804746,0,0
0,"Yep, he shall return no more 🗿",1,130982,556.4364421804746,0,1
1,Happy Birthday Sit Christopher Lee!,1,2084173,809.8531088471412,1,1
0,There is help.,1,104989,557.2531088471412,0,1
1,Historical Bear Markets,1,2048110,503.069775513808,0,1
1,Double standard #1620,1,125471,412.1364421804746,0,1
1,300lb stone lifted by this amazing woman,1,868850,158.6697755138079,0,1
1,The True Joker,1,237605,465.7364421804746,1,1
1,Spoiler: they don't care,1,477556,316.36977551380795,0,1
0,New Weapon,1,71920,190.85310884714127,0,1
0,Blue lives piss themselves,1,63304,443.7864421804746,0,1
0,coming home from school i come across this (I don't speak English I'm using Google translator),1,416095,347.81977551380794,0,1
1,360° view from the top of Mount Everest.,1,9715480,487.3119049231211,1,1
1,Inspired by a recent comment thread - discussion time - which would you choose?,1,684268,588.5285715897878,0,1
0,jules x rue! (art by me),1,257765,287.9785715897878,0,1
0,"""Bro, come check out this creature""",1,1385022,169.36190492312113,0,1
1,"i know this is gonna be fun, scar me for life respected blood sucker folks",1,2364992,422.5785715897878,0,1
0,"""Don't worry... I got this, tiny human""",0,3525526,368.1285715897878,1,0
0,Alex with Kate Upton,1,218255,312.6285715897878,0,1
0,He not allowed up front when I’m driving so he just rests his head on my shoulder. He warms my heart.,1,31229349,366.3285715897878,1,1
1,I think this goose is trying to be a wind up toy…..,1,4998611,477.2785715897878,0,1
0,This ape only wants Powerade,1,134827,439.2285715897878,0,1
0,I made a tree arm ring with wire and a couple of labradorite beads.,0,928945,380.2119049231212,0,0
