target,title,is_reddit_media_domain,subreddit_subscribers,post_age_min,is_successful_subreddit,is_successful_domain
1,The big old question,1,130120,711.8889157970747,0,1
0,"The Ballet, He Jiaying, 2006 [600 x 1011]",1,606770,641.0555824637413,0,1
1,I'm jelust,1,932671,504.122249130408,0,1
0,[RF] Owlfred the Potoo part deux,1,243912,382.4889157970746,0,1
0,Authorities said the gunman was able to obtain the weapons legally.,1,68402,231.672249130408,0,1
0,Woo Can Cook | Hawaiian Matcha Cream Puffs,0,3250749,155.6555824637413,0,0
1,Make Sure Your Voice Is Heard,1,538375,476.1555824637413,0,1
1,LeBron Confused By Hockey Players Who Get Back Up After Getting Knocked Down (Babylon Bee),0,353743,223.78891579707465,0,0
0,MIZ LIZ! TWO HOT TODDYS!,1,196617,424.522249130408,0,1
1,I was searching for weird polish name (as a joke) and I came around this.,1,363631,406.572249130408,0,1
0,"Both are great, BTW.",1,117832,333.6555824637413,0,1
1,The basic geometry of the face. He's not hot! Just an average looking dude with a big chin!,1,540957,558.0389157970747,0,1
0,Inside my cardigan,1,78274,327.27224913040794,0,1
1,"parasites being removed from wasp, surprise frog at the end",1,67553,351.83891579707466,0,1
0,That winky face doe.,0,382753,140.48891579707464,0,0
1,Dreadnouht Redemptor,1,490913,774.1555824637413,0,1
1,"Morning, gorgeous. By @atie1225.",1,305508,1102.8889157970746,0,1
0,Ei at the beach,1,71963,437.1555824637413,0,1
1,Suicide attempts gone wrong are always a poor sight. That white spot inside the head of the patient is a bullet. It missed all the vital parts of the brain but shattered his face almost completely! There were fragments of bones from the face that were missing!,1,619031,709.3889157970747,0,1
0,Sandwich served.... On the rocks,0,784192,293.8889157970746,0,0
1,Landlord increasing rent by $600. Is there even any sense to fight it?,0,894904,441.2055824637413,0,0
0,Can’t escape this face,1,122257,304.3889157970746,0,1
0,Tetanusfiets in Utrecht,1,672337,378.7555824637413,0,1
0,SERIES: Done. Put the mavs to bed and now we goin to the Finals again.,1,410389,416.03891579707465,0,1
0,Alchemy is great!,1,137410,857.2555824637413,0,1
1,Arbonne hun's mom died suddenly last week. She took a few days off from posting and then just posted this.....,1,769076,527.7889157970747,0,1
0,my grandma's cat cricket. 13 years old.,1,76145,209.8055824637413,0,1
0,Every time...,1,133704,258.6555824637413,0,1
0,40k.Alien plant life. Italian style,1,115869,126.31422332525251,0,1
0,Flying High (Credit to Bill Whitehead),1,11488555,96.5808899919192,0,1
0,Goat 🏆,1,641295,468.4808899919192,0,1
0,She waited her *hole life for this moment.,0,889868,667.2808899919193,0,0
1,Reasoning with yourself on why you only need 5 hours of sleep for work.,1,32979624,452.7475566585859,1,1
1,"#theyfeelpain (but it only matters until they’re born) cw: pro-life bs, Pest",1,154849,350.4975566585859,0,1
1,Point of view: Die Öffnungsklappe der Dosenbohnen ist mal wieder kaputt gegangen.,0,627911,214.59755665858583,0,0
0,New assassination method,1,133953,337.46422332525253,0,1
1,Fun fact: through the power of variants you’re able to create 16 possible Iron Sight combinations with the M4A1. Maybe more but this is as far as I know,1,1319402,699.8475566585859,0,1
1,Fear me!,1,5020809,1024.0475566585858,0,1
1,"TIL in 1967, hundreds of Singaporean men panicked that their penises were disappearing into their abdomen. They were actually fine but had succumbed to a culture-bound delusion disorder known as koro, which means turtle (as in a turtle’s head retracting into its shell)",0,27718188,571.3642233252525,1,0
0,My lab razor is a Slice Guy. what's the name of your favorite lab equipment?,1,544057,296.1142233252525,0,1
1,Lenny Kravitz and his absolute unit of a scarf,1,1153938,932.4308899919192,0,1
0,"Hey mum, my uni exhibit is in a couple of weeks and the closest connection I have to you isn’t coming to see it. It’s been 13 years and you didn’t get to see what I would do with my life. I wish you could see my photos and be proud when no one else is.",1,258044,520.4642233252525,0,1
0,"I wish I did, no school, no homework just watermenol",1,86883,565.1808899919192,0,1
0,"they get a ""kick"" out of it...",1,105300,456.0308899919192,0,1
0,Beautiful Hair,1,61110,347.8642233252525,0,1
1,MWII artwork shows up on Steam suggesting franchise possibly returning,0,2805228,621.9142233252526,0,0
0,10 day old tortie 🥺,1,48188,537.4975566585858,0,1
0,Candid Shot,0,121581,325.6308899919192,0,0
1,"Sup Guys! this is your last chance to join the cult, are you in?",1,233852,259.4975566585859,0,1
0,Throwback to ponytail Hwa Ryun,1,104145,481.5308899919192,0,1
1,Jurassic Park but with a cat,1,747112,585.2642233252525,0,1
0,abrikosov vortices,1,135505,820.9975566585858,0,1
0,With or without shoes?,1,187724,272.96422332525253,0,1
0,chainsaw man fanart by me,1,1384199,679.8808899919192,0,1
0,When a single mother offers me sex for rent. (I don’t allow rentoids to touch me.),1,69977,438.2475566585859,0,1
1,I miss the time we can attack freely,1,172198,555.8808899919192,0,1
1,"Six, but this sub man...",1,491761,248.64755665858587,0,1
0,fit,1,1909414,379.29755665858585,0,1
0,A window I tried to make more cheerful with fake flowers. The colors cheer me up when I walk past them.,1,73887,613.6142233252525,0,1
1,O365 Free Dev Tenant,0,700191,465.4475566585859,0,0
1,Sweet chihuahua mauled by pitbull dies in animal hospital. Mods locked original post and defends pitbull,0,53306,475.84755665858586,0,0
0,Day two for the art festival. Hopefully get some sales today 🤞,1,435292,573.6975566585859,0,1
0,That feel when you get the gym to yourself,1,191697,175.91422332525252,0,1
1,"""Karen has blocked you""",0,6281193,160.66422332525252,1,0
0,"Maybe not that cool, but I did my first ever second ascent of a big wall in Zion last week. Saw this huge cave mountain weeks ago, planned, prepared and came back and Sent. I cried on the shuttle bus afterward from being so happy/worn out.",0,1087750,451.2642399787903,0,0
1,"Since build 41.69, this game hits hard",1,158465,717.3309066454569,0,1
1,"The police ""Had No Legal Duty to Act"": Enraged Americans Expected Uvalde Cops to Fight to the Death to Stop Elementary School Massacre. .",0,505560,579.930906645457,0,0
1,She's just a good person,1,85379,484.5809066454569,0,1
1,Sirrrrrrrrrrrrrrrrrr,1,771654,951.4142399787904,0,1
1,(OC) Time for nap,0,3822204,696.5142399787903,0,0
0,before and after i stopped biting my nails… still not perfect but a lot of improvement,0,533766,651.8309066454569,0,0
0,Saw this in an ad,1,180467,140.66423997879028,0,1
1,I found it. I REALLY like it.,1,725294,315.0309066454569,0,1
0,The most unrealistic part in Avengers (2012) was a billionaire was willing to sacrifice himself to save other people,1,823507,430.1475733121236,0,1
0,"""Angels fall into starocean"" by Clander Chen",1,414217,736.2642399787903,0,1
0,I broke out the Harkerware this morning so I could pretend I'm having coffee with Samantha and Darrin.,0,145363,436.4975733121236,0,0
1,egg🪒irl,0,255705,550.780906645457,0,0
0,My crush in school IRTR,1,526603,676.5975733121236,0,1
0,Thought y’all would enjoy this as much as I do 😂,1,1251486,300.6142399787903,0,1
1,"After an eternity, java.com has updated its homepage",1,2003058,490.8642399787903,1,1
1,is grandma criticizing capitalism and when were people able to afford cars and house during trump?,1,379929,667.4975733121236,0,1
1,"Apparently being Pro-2A makes you a ""right-wing extremist""",0,176062,377.2809066454569,0,0
0,Fatherless,1,56610,439.7809066454569,0,1
0,"Würde zwar den Flair für den Wöchentlichen-Wettbewerb nutzen, ist aber..",1,27729,651.7975733121236,0,1
0,Amazing jump!!🙀,1,53031,152.3475733121236,0,1
1,Netflix really needs to stop showing spoilers in the preview and image's when scrolling.,0,1386829,486.0475733121236,0,0
0,Nett.,1,10367,220.56423997879028,0,1
1,petition to make the sub icon the slippin' jimmy version of jimmy because it's far superior,1,99339,641.0809066454569,0,1
0,Esse portão na casa da minha vó que fecha na base do arbusto,1,34642,129.24757331212362,0,1
1,Get Ready For $8-A-Gallon Gas,0,893011,396.5975733121237,0,0
0,A weekly spread! ❤️,1,667038,151.08090664545696,0,1
1,George Carlin had a Band-Aid over his wedding ring playing a Cardinal in 'Dogma' (1999) because his wife had recently passed and he wasn't ready to take it off yet.,0,3171183,1195.730906645457,0,0
0,The Class Distraction,1,43109,317.04757331212363,0,1
1,Google is deliberately spreading misinformation and propaganda,1,294902,861.2642399787903,0,1
1,Larreta y su plan maestro.,1,407173,510.7975733121236,0,1
0,my sweet baby boy having his midday snooze 😴,1,364839,725.780906645457,0,1
1,What is this art style called? It looks incredible,1,906246,978.4475733121236,0,1
0,Rin Sister iceberg,1,175661,455.8975733121236,0,1
0,It would've been nice to see an ocean on Mars,0,196842,251.93090664545696,0,0
0,Berlin chasing a laser with her taco in her mouth. r/catscarryingstuffies,1,42152,622.030906645457,0,1
0,The Council of Archmage - Lead of Soulbinders by Tooth Wu,1,221999,208.3475733121236,0,1
0,"A woman & friend walked through a side-door, past Secret Security and Police, into reserved seating for former President Trump’s Speech at the NRA Annual Meeting in Houston",0,559511,145.56423997879028,0,0
0,Frustrated guy cooking,1,384099,407.4142399787903,0,1
0,WCGW Throwing a light rock at a car window?,1,6249100,511.1642399787903,1,1
1,look what the neo-confederates are up to now.,1,66282,450.5309066454569,0,1
0,real,1,53552,501.0475733121236,0,1
1,‘Good gal with a gun’: Woman with pistol kills gunman at party. / I think the media is suppressing this good news. Share share share!,0,159369,457.5142399787903,0,0
0,can't help it,1,1166735,523.5642399787903,1,1
0,[3] Got the shiny Kyogre after 733 SRs with my automated LEGO shiny-checker.,1,178105,441.1142399787903,0,1
1,"I just posted here recently, but they keep coming. To explain, I'm girlflux, which means my gender identity fluctuates, yet stays on the feminine identity side. I mostly fluctuates between demigirl, non-binary, and agender. I rarely ever feel fully feminine, or ""fully a girl"". Oh, and I'm afab. 🤨",1,62760,374.3975733121236,0,1
0,Special Marin and Gojo Illustration by OP storyboard artist Aoi Umeki!,1,40660,627.8642399787902,0,1
1,I know spot colouring went out of style decades ago but I’ve never tried it so keep an open mind.,0,1432146,459.4475733121236,0,0
1,Morgy’s obsession with being seen as “cool”. Apparently she never left that 6th grade mentality.,1,104196,387.3642399787903,0,1
1,Pretty simple and well worth owning some Bitcoin.,1,4242463,656.1975733121236,0,1
0,You must be this drunk... for a ride.,1,159229,638.8642399787902,0,1
0,Waiting for a Signature,1,865315,113.61423997879028,0,1
0,holesome humanity,1,53651,379.5142399787903,0,1
1,Burn it. Burn it all.,1,6814228,407.18090664545696,0,1
0,Did Dream Actually Buy MCC?,1,94080,549.4642399787903,0,1
0,someone has converted a minecraft map to enfusion,1,139404,447.0142399787903,0,1
1,Which song makes you feel like this?,1,471275,451.1475733121236,0,1
1,Diamond 4 Arenas. These are my teammates. Matchmaking needs fixed still. Guys low key Genburten.,1,2083067,564.7642399787903,0,1
1,Match Thread: Final - Gujarat Titans vs Rajasthan Royals,0,500329,541.5975733121236,0,0
0,in a sub for the adidas company,1,563985,1042.4975733121237,0,1
0,This little goon wasn't allowed on the couch for awhile but Potato is back baaaaaby!,1,111786,480.43090664545696,0,1
1,How 3 multiplications and 2 additions... end up being much faster than just 2 additions.,0,4208036,794.4057580749194,0,0
0,I hope he's doing well........./,1,1142222,410.4057580749194,0,1
1,Let this man on,1,125335,811.422424741586,0,1
0,“Uncle Gwen! I was under the ice for Six minutes. Black doctor says I was almost a Angel.”,1,126995,380.7890914082527,0,1
1,Kangaroo cuddle,1,841702,1029.1890914082528,0,1
1,Inner peace for Zoro,1,217426,663.0224247415861,0,1
0,reddit is safe,1,2048823,351.02242474158606,0,1
0,Well thats obvious..,1,82911,758.7390914082528,0,1
0,The Aston Martin Valkyrie,1,961479,425.9224247415861,0,1
1,Some say the translation has been lost for years,1,285008,476.22242474158605,0,1
0,"Sorry, force of habit",1,1069968,609.7890914082527,0,1
1,GOATIFI IS BACK,1,582399,508.52242474158606,1,1
1,The ice coffee and lemonade lids remind me of pee and poop,1,220108,452.6390914082528,0,1
1,"I haven't played this game since July of last year, what did I miss?",1,115084,573.072424741586,0,1
0,anon has a nice girlfriend,1,306429,179.75575807491938,0,1
1,Racism,1,84143,667.7890914082527,0,1
0,Brown sugar on bacon and put into the air fryer. Easy Candied Bacon,1,2669541,242.07242474158605,0,1
0,What babysitting does to a jedi,1,30295,357.25575807491936,0,1
0,"And the way these energy bills are going, indoor ain't much cheaper.",1,5552609,507.7390914082527,0,1
0,mod cring!!!! (dont mind the watermark I don't know how to crop gif),1,391089,449.4057580749194,0,1
1,Just Got Married,1,650274,564.672424741586,0,1
1,ACTUAL American food starter pack,1,3173697,420.1724247415861,1,1
1,but where does Kevin Lee fit into all of this?,1,581322,197.60575807491935,0,1
0,BBP named Izzy,0,83173,232.6557580749194,0,0
0,Every class trial be like,1,298456,709.8724247415861,0,1
1,can you imagine?,1,464147,767.672424741586,0,1
0,"Oops, I meant Hollie",1,152148,288.12242474158603,0,1
0,Uncle Owen vs. Kaladin,1,72694,674.8390914082527,0,1
0,Manny Jacinto,1,319146,227.9057580749194,0,1
1,The Continued NSCC Liquidity Crisis & An Idiosyncratic Stock + NSCC-2022-006 Information,0,788262,290.62242474158603,1,0
0,Someone got the best birthday cake ever!,1,654196,321.6890914082527,0,1
0,"Hi, Earth 🌎",1,18503,313.1890914082527,0,1
0,LUNA 2.0 Is The Future!,1,834019,498.8224247415861,0,1
1,"He told me I couldn't have a new cat after we lost our last one, then a feral had kittens in our backyard and abandoned 4 at 24 hours old. 4 weeks later, we have 4 kittens.",1,260581,1060.022424741586,0,1
1,Early game in nutshell,1,93880,688.8557580749194,0,1
0,Prehistoric Bachelor’s club,1,120309,422.8224412878354,0,1
0,A short story,1,73404,428.5391079545021,0,1
0,WHY does that just look like jerma. i have done irreparable damage to my brain,1,100913,704.4557746211688,0,1
0,I hope this pic doesn’t blow Matt Patt’s mind,1,584870,287.92244128783545,0,1
0,Selfie in red,1,166969,411.0557746211688,0,1
1,Does this even need a title ?,1,178552,469.7557746211688,0,1
1,"$80bn in weapons left in Afghanistan when we have completely unsecured boarders, gun control is a non-starter.",1,97521,552.7557746211688,0,1
0,it do be like that,1,144630,347.3557746211688,0,1
0,Do I get a bonus then?,1,40607,183.5391079545021,0,1
1,poor Sakura :(,1,1347100,604.2724412878355,0,1
0,Grumpy Bear Not Liking His Sushi.,0,186250,387.8724412878354,0,0
0,a lazy Sunday while cleaning the house,0,2940710,361.8057746211688,0,0
0,I wonder...,1,125838,662.3724412878354,0,1
1,minä🇫🇮irl,1,32730,339.03910795450213,0,1
0,"Mohammed Shami's Yorker to Riyan Parag, GT vs. RR, IPL 2022 Final",1,13154,367.3557746211688,0,1
0,Linus's radiator table is nothing compared to this,1,199208,515.4557746211688,0,1
0,He's got a point,1,166441,638.0391079545021,0,1
0,"Ah yes, socialists want to steal Elizabeth's champagne",0,28280,356.1391079545021,0,0
1,Old school parenting,1,40840796,660.2891079545021,1,1
0,"1987 mugshot of Charles Anthony Boyd, a serial killer active in Texas in the 1980s. He became known as “The Bathroom Slayer” due to attacking all of his victims in their bathrooms, raping, and strangling them.",1,555294,317.5057746211688,0,1
1,Century eggs = nope yolks,1,341343,656.6057746211687,0,1
1,"Scientists Tweaked Genes in a Way that Made Hamsters Very, Very Angry",0,366773,223.4391079545021,0,0
0,Split the Health Bar,1,187122,437.8891079545021,0,1
0,The size of this draft horse.,1,381503,136.23910795450212,0,1
1,Janet!,1,599513,643.1057746211687,0,1
1,Japanese plastic model manufacturer Tamiya introduces 'Russian invader' figurine series,1,104576,938.4557746211688,0,1
1,Bold and brash,1,756251,1036.039107954502,0,1
1,I am giving up TOTS token swaps,0,601296,315.22244128783547,0,0
0,She is quite at a loss.,0,3426803,477.72244128783547,0,0
1,"4.7 meter/15.5 ft Saltwater crocodile pulled from Darwin Harbor, Australia by a Northern Territory Parks & Wildlife crew, earlier this month.",1,744862,614.5724412878354,0,1
0,Moose vs Grizzly at Many Glacier,1,45098,224.3057746211688,0,1
1,Tanith when her husband fucking dies,1,1377548,632.0057746211688,1,1
1,Found him on the road… he’s claimed me now… and also my dog…,0,3529225,334.92244128783545,1,0
0,The “Yankee Commandante” William Morgan holds a highly customized Model 1907 known as a Cuban Winchester used during the Cuban Revolution.,1,97066,533.0724412878354,0,1
1,After rewatching the entire MCU - I've finally pinned down my favorite scene. (more in comments),1,2605021,1038.1057746211688,0,1
1,only a matter of time until this is real,1,432775,490.9557746211688,0,1
1,Possibly drunk driver assuming he is in the correct lane.,1,3761052,391.7557746211688,1,1
0,"India, Bhutan, Nepal, Taiwan, Japan, South Korea and Southeast Asian nations would beg to differ with you.",1,46815,140.37244128783544,0,1
1,"Hey guys, how bad is this dent? (parody)",1,1047180,182.0891079545021,0,1
0,Egg porn at Ramen Hiiki (Tokyo),1,376587,457.1057746211688,0,1
0,Most of Kengan‘s mysteries could be solved if these 4 just sat down and talked with each other,1,41491,539.7391079545021,0,1
1,Trying to feel beautiful!🥰,1,283479,578.8057746211688,0,1
1,"‘Top Gun: Maverick’ Soars To $124M 3-Day, $151M 4-Day Fantastic Memorial Day Opening; Best Ever For Tom Cruise – Sunday AM Update",0,866086,430.7891079545021,0,0
1,"Jackie Chan at a benefits concert in Hong Kong supporting the Tiananmen Square protestors, 1989",1,16063925,1012.989107954502,1,1
0,Tennant (who is a time lord) is the sweetest.,1,320359,139.98910795450212,0,1
0,Thought of making a little video for my birb,1,336537,438.1391079545021,0,1
0,This monkey seems like a cool dude,1,2343490,557.0057746211688,0,1
0,Anne Hathaway,1,655052,310.6391079545021,0,1
0,"The Apotheosis of War, Oil on Canvas, Vasily Vereshchagin, 1871.",1,153280,372.9391079545021,0,1
0,"Throwback to longer haired Liz, 2021",0,124901,235.3057746211688,0,0
1,"Made it to 30 years without a single break, then today my heavy ass phone fell on my foot. Farewell strong boned people.",1,431419,329.9891079545021,0,1
1,THIRST CHECK: DRINK A GLASS OF WATER RIGHT NOW,1,1079776,981.9557746211688,0,1
1,Armed female bystander kills man firing at party in West Virginia,0,24729427,580.6891079545021,1,0
1,My house has a working total home automation system including touchscreen..... from 1985,0,175313,304.03910795450213,0,0
1,"Don’t mind me, I’ll just be living in this dress all Summer.",1,66522,441.8391079545021,0,1
1,"[Cover] Flashpoint Beyond #2 (Variant Cover) – by Ivan Reis, Danny Miki & Brad Anderson",1,671261,604.0891079545021,0,1
0,NV arriving at LANdon with the other NA teams,1,101928,285.9891079545021,0,1
0,*Sad Byzantine Noises*,1,111431,515.8724412878354,0,1
1,Which segment of the UK economy baffles you by its continued existence?,0,639939,287.8891079545021,0,0
0,Morbeni time,1,15392,210.0057746211688,0,1
0,Hurts right here,1,76278,487.97244128783547,0,1
0,Spamton's Freedom (by zarla-s),0,215682,433.4500078002612,0,0
1,The gift that keeps on giving,1,2087244,347.7500078002612,1,1
0,Moments like this are why I love the black bulls,1,222090,384.23334113359454,0,1
1,"‘Finally! Now we’re out of the EU, the metric system is no longer mandatory!’",1,128533,453.4166744669279,0,1
1,Pastor Malafaia envelhecendo como leite,1,881526,521.9500078002612,0,1
0,So gorgeous,1,60429,531.4166911443075,0,1
0,"so tired of their cynicism, let's try to keep the lighthearted vibe on here! ☮️💛⭐️✨",1,173501,216.3000244776408,0,1
1,2022 Double Winners,1,382262,395.7500244776408,0,1
1,Imagine thinking that Morbius is the greatest movie ever made lol!,1,94884,432.3500244776408,0,1
1,Greve na CP durante 27 dias,0,237918,362.8000244776408,0,0
0,And that's how one lost their pronouns,1,17184,337.56669114430747,0,1
0,"The ""Combat Acceleration"" modifier for Nightfalls might be one of the worst negative modifiers we've seen. A 2-3x increase in all ability cooldowns, with the core mechanic ""gain energy when damaging enemies"" doing almost nothing.",0,2548552,199.06669114430744,0,0
1,"Look Ma, we're on the news",1,12334,448.3833578109741,0,1
0,Sigma Tip #27638 — do not let betas interrupt your “business”,0,40479,173.50002447764078,0,0
0,Memorial Day cake,1,188373,679.4500244776408,0,1
0,seen on German aircraft today,1,432129,197.91669114430744,0,1
1,DELHI in alternate universe,1,78059,745.1833578109741,0,1
0,M/23/5’9” [130 lbs - 185 lbs] (5 1/2 years) - Hard work and force feeding,0,206321,352.21669114430745,0,0
0,Tent View [1920x1200],1,1811102,528.6166911443074,0,1
1,"Rumor: Bethesda’s Indiana Jones game may not be Xbox exclusive, it’s been claimed",0,628613,613.5833578109741,0,0
0,Could Marley have survived the Cartening?,1,40562,304.81669114430747,0,1
1,Summoners should also have chorophyte-based set. All sprites by me.,1,998145,258.1000244776408,0,1
1,Husband surprises bride by flying her parents from Brazil to their wedding,1,5519108,537.6833578109741,1,1
0,Our two sweet sisters,1,69735,537.1833578109741,0,1
0,"Found on my Facebook, in reference to a couple I went to high-school with",1,90744,804.6333578109741,0,1
0,Guided Missile Dogfight - Blender Physics,1,722154,512.3500244776408,0,1
0,"Pink man, the papercut overlord",1,1282564,377.4166911443074,0,1
0,"Ps: Don't tell your other brothers, Pilot and Sailor.",1,229531,434.51669114430746,0,1
1,Why companies don't retain talent?,0,819860,623.4666911443074,0,0
0,Harper suited up to take on the Sand Dunes,0,288930,452.7833578109741,0,0
0,"started up a new game a while ago, drew lohse and sebille to celebrate! ^_^",1,187362,360.18335781097414,0,1
1,Smacking a kid half your size and age…,1,753528,563.2666911443074,0,1
1,bEsT FiNiSheR,1,137237,373.7000244776408,0,1
0,Show me all those belts champ 🤤😩,1,97031,384.6000244776408,0,1
1,Truth! You’ve been warned. Again. 🔥🔥🔥🍿🦍🚀🌕☝🏼#amc #ape,1,467594,492.3833578109741,0,1
0,Their proof of marriage,1,83614,514.3833578109741,0,1
1,Komolyan mondom a Neptunt valami hungarikummá kéne nyílvánítani..,1,213962,764.9000244776408,0,1
0,America is not ok,1,26128,382.7833578109741,0,1
0,This slaps.,1,136018,468.0000244776408,0,1
0,Found this absolute madlad at MCM 2022,1,927547,278.1166911443075,0,1
0,"Hello, it's the Water Fall. We don't have publisher, and doing this thing. What you thinkin?",1,275033,426.46669114430745,0,1
1,🙍🏻‍♂️,1,43675,529.5666911443075,0,1
1,Government Spending & Stock Market,1,12190639,795.0166911443074,0,1
0,Kurisu drawn by 藤狐 fujiko,0,114872,363.5666911443074,0,0
0,The struggle is real.,1,247515,370.7500244776408,0,1
0,Pumpkin hater,1,858325,546.2500244776407,0,1
0,When you’re the chief of police and there’s a school shooting,1,53274,399.0666911443074,0,1
0,"President Biden, First Lady comfort Uvalde community in wake of deadly shooting",1,81916,243.41669114430744,0,1
0,Being tall: expectations vs reality,1,137914,163.13335781097413,0,1
1,US surpasses China as India’s biggest trading partner in FY22 at $119.42 billon,0,350775,872.1333578109741,0,0
1,If Wizards of the Coast made the Eevolution Alt Arts,1,170042,629.0000244776407,0,1
1,My students called me fat today,0,3389298,711.9833578109741,0,0
0,"Florida man student wears 'Scream' outfit, brings fake knife to school",0,748481,283.71669114430745,0,0
0,I just think I'd be good for her and she'd be good for me is all,1,55306,216.71669114430745,0,1
1,Soooo look who’s on my flight today 😂😂 I fucking can’t.,1,25377,375.7333578109741,0,1
0,Darth Revan cosplay I made,1,113972,640.9500244776408,0,1
0,Combat Juggling!,0,496658,509.3000244776408,0,0
1,What's going on with immigrants in Sweden?,0,2892190,772.3500244776408,0,0
0,The Inverse Crypto Lounge - Let's make the crypto space safe together,0,1758395,208.0500244776408,0,0
0,"Thanks, I hate this cursed sushi",1,310531,537.7500244776407,0,1
1,Yaparken en keyif aldığım memelerden biri oldu,1,207595,767.9166911443075,0,1
1,Random Wedding Ceremony,0,471249,651.7000244776408,0,0
1,Godskin Maiden,0,63304,689.0666911443075,0,0
1,For all those who saw Twisty yesterday…this is him this morning,1,166976,685.2333578109741,0,1
0,😗,1,134293,506.9500244776408,0,1
0,Found on r/teenagers,1,157027,703.9833578109741,0,1
0,No lies detected 😬😬,1,5639023,363.3333578109741,1,1
0,(=,1,122231,752.6833578109741,0,1
0,How the glass perfectly fits into the table,1,6941304,381.51669114430746,1,1
0,"Uh-huh, okay",1,242749,142.88335781097413,0,1
0,A little Milkyway action on the Tongariro crossing Saturday night.,1,356600,272.68335781097414,0,1
0,One from a recent explore in Wales. More info in comments [OC],1,1926475,385.3833578109741,0,1
1,[gendered] The fact men and women should be treated differently when facing emotional abuse,0,370398,690.3500244776408,0,0
1,Wait for it 😂……………….,1,123093,607.2000244776408,0,1
0,Luigi is smart,1,353644,404.8333578109741,0,1
0,Mudrock [Arknights],0,23589,282.06669114430747,0,0
0,They have annoyed me for far too long,1,352531,415.4333578109741,0,1
0,Playing since chapter 1 still hasn’t improved my skills,1,1944942,615.5833578109741,0,1
1,"Does everyone with a toddler mostly kind of hate their life? Or am I just burned out/depressed? Please don’t downvote, genuine question.",0,301869,668.1500244776408,0,0
